datetime,ticker,headline,sent_compound,sent_label,sent_positive,sent_negative,trading_day
2023-12-19 03:01:08,AMZN,Good news for late holiday shoppers : Retailers are improving their delivery speeds,0.89622897,positive,0.90718704,0.010958104,2023-12-19
2023-12-18 18:16:02,AMZN,Communications Services Up With Risk Appetite -- Communications Services Roundup,0.8754372,positive,0.8904967,0.0150594525,2023-12-19
2023-12-18 03:01:07,AMZN,"Games Workshop Agrees to Warhammer Film, Television Series Development With Amazon",0.65660566,positive,0.6655448,0.00893915,2023-12-18
2023-12-18 02:56:07,AMZN,"Games Workshop seals Amazon deal for Warhammer 40,000",-0.949779,negative,0.0185593,0.96833825,2023-12-18
2023-12-14 16:27:15,AMZN,Amazon’s S-team : Meet the 31 members who make up our senior leadership team,0.019204158,neutral,0.036336496,0.017132338,2023-12-15
2023-12-14 08:49:06,AMZN,Amazon won't have to pay hundreds of millions in back taxes after winning EU case,0.5009269,positive,0.724811,0.22388412,2023-12-14
2023-12-14 08:00:00,AMZN,"AT&T to buy Rivian electric vehicles in pilot deal to cut cost, emissions",0.7108004,positive,0.7199687,0.009168268,2023-12-14
2023-12-14 03:59:48,AMZN,EU top court rejects 250 mln EU tax order to Amazon,-0.93334585,negative,0.0181638,0.95150965,2023-12-14
2023-12-12 08:32:37,AMZN,"Amazon to defend iRobot buy at Dec 18 EU hearing, source says",0.34571332,neutral,0.4211416,0.07542827,2023-12-12
2023-12-12 03:12:05,AMZN,Top Five Patents For Fintech Inventions,0.33861226,neutral,0.3557423,0.017130041,2023-12-12
2023-12-11 08:51:08,AMZN,Amazon testing a humanoid robot for warehouse operations,0.12344508,neutral,0.13206673,0.008621644,2023-12-11
2023-12-11 05:58:09,AMZN,Amazon Redshift announces enhancements to Advisor sort and distribution key recommendations,0.2837122,neutral,0.2955273,0.011815096,2023-12-11
2023-12-08 12:26:50,AMZN,X discusses using Amazon's ad-buying software - WSJ,0.25722757,neutral,0.26607755,0.008849982,2023-12-08
2023-12-08 12:18:04,AMZN,X Is Working To Lure Smaller Advertisers As Elon Musk Keeps Alienating Big Brands - WSJ,0.7188561,positive,0.7495315,0.030675415,2023-12-08
2023-12-08 05:17:03,AMZN,New Book Empowers College Students with a Blueprint for Healthy Eating,0.34489653,neutral,0.35384297,0.008946461,2023-12-08
2023-12-08 05:11:12,AMZN,Judge Albright Denies Amazon And Eero's Motion To Dismiss For Improper Venue And To Transfer Venue To The Northern District Of California,-0.11268258,neutral,0.047653902,0.16033648,2023-12-08
2023-12-06 03:42:42,AMZN,Twitch to shut down in South Korea due to high costs,-0.93147135,negative,0.008657794,0.94012916,2023-12-06
2023-12-06 02:21:06,AMZN,Commercial space station chooses AWS as IT infra,0.44064987,neutral,0.44858155,0.007931692,2023-12-06
2023-12-05 18:05:23,AMZN,Washington Post journalists plan 24-hour strike amid prolonged contract talks,-0.94858694,negative,0.011048788,0.95963573,2023-12-06
2023-12-04 09:14:02,AMZN,Amazon com : Get an inside look at how we’re sending some of your orders without Amazon packaging,0.06410627,neutral,0.076790415,0.012684147,2023-12-04
2023-12-04 06:13:50,AMZN,Mobile telecoms company Veon signs deal with Amazon to support Ukraine businesses,0.92510676,positive,0.9395956,0.014488844,2023-12-04
2023-12-02 06:00:00,AMZN,Impact of Amazon's climate-driven drought may last until 2026,-0.91546094,negative,0.016248839,0.93170977,2023-12-04
2023-12-01 14:46:05,AMZN,Amazon to launch three Falcon 9 rockets of SpaceX,0.86210155,positive,0.87089574,0.008794208,2023-12-01
2023-12-01 14:43:04,AMZN,Amazon Secures 3 Launches With SpaceX To Support Project Kuiper Deployment,0.915343,positive,0.9297485,0.014405499,2023-12-01
2023-12-01 04:31:03,AMZN,Zara founder buys Amazon logistics centre in Dublin for $245 million,0.29807827,neutral,0.3100214,0.011943139,2023-12-01
2023-11-30 10:45:32,AMZN,XXImo becomes one of the first Visa card issuers in the EU to process payments entirely through the AWS Cloud,0.56287056,positive,0.57092744,0.008056908,2023-11-30
2023-11-30 09:26:06,AMZN,SkinBio launches food supplement on Amazon,0.01912182,neutral,0.03529345,0.016171629,2023-11-30
2023-11-29 19:30:00,AMZN,Indian economy expected to sustain strong growth amid global gloom,0.9354422,positive,0.9547014,0.019259222,2023-11-30
2023-11-29 13:23:03,AMZN,"Humanoid robots are here, but they're a little awkward. Do we really need them?",0.23214573,neutral,0.24753644,0.015390716,2023-11-29
2023-11-29 12:43:03,AMZN,EU Commission lawyers initially opposed warning Amazon on iRobot deal - sources,-0.7112299,negative,0.03185402,0.74308395,2023-11-29
2023-11-29 10:48:03,AMZN,Amazon : 'Black Friday' and 're,0.9236067,positive,0.9445531,0.020946372,2023-11-29
2023-11-29 09:05:01,AMZN,Cathay Selects AWS as Its Strategic Cloud Provider,0.912901,positive,0.92173135,0.008830376,2023-11-29
2023-11-29 08:32:27,AMZN,Karcher Migrates SAP Environments to AWS,0.46552193,neutral,0.47425038,0.008728431,2023-11-29
2023-11-29 04:48:08,AMZN,AWS announces Amazon Aurora PostgreSQL zero-ETL integration with Amazon Redshift (Public Preview),0.109956235,neutral,0.119030654,0.00907442,2023-11-29
2023-11-28 19:01:00,AMZN,Second-hand shopping a $1-bln-plus business for Amazon in Europe,0.20766664,neutral,0.33653888,0.12887225,2023-11-29
2023-11-28 13:39:02,AMZN,Amazon com : Learn how Project Kuiper leverages AWS to provide secure connectivity from virtually anywhere,0.4310501,neutral,0.43983132,0.008781223,2023-11-28
2023-11-28 13:14:56,AMZN,Amazon looks to lure corporate customers with generative AI safety measures,0.039487936,neutral,0.13565366,0.096165724,2023-11-28
2023-11-28 13:10:02,AMZN,AWS Announces Four Zero-ETL Integrations to Make Data Access and Analysis Faster and Easier Across Data Stores,0.5230328,positive,0.5333669,0.010334109,2023-11-28
2023-11-28 13:01:02,AMZN,AWS Announces Four New Capabilities for AWS Supply Chain,0.6218983,positive,0.63110775,0.00920946,2023-11-28
2023-11-28 12:52:02,AMZN,"Amazon Connect Introduces Generative AI Capabilities to Help Organizations Boost Worker Productivity, Save Costs, and Improve Customer Service Experiences",0.49260688,positive,0.5017876,0.009180736,2023-11-28
2023-11-28 12:40:03,AMZN,Amazon : extends technology collaboration with Nvidia,0.9206327,positive,0.9307604,0.010127675,2023-11-28
2023-11-28 12:13:01,AMZN,"AWS and NVIDIA Announce Strategic Collaboration to Offer New Supercomputing Infrastructure, Software, and Services for Generative AI",0.79821026,positive,0.80546886,0.00725861,2023-11-28
2023-11-28 11:50:04,AMZN,﻿Amazon's Project Kuiper and NTT/SKY Perfect JSAT Form Strategic Collaboration to Bring Advanced Satellite Connectivity Options to Japan,0.89599144,positive,0.90373087,0.0077394163,2023-11-28
2023-11-28 11:49:03,AMZN,"Amazon com : More Than 1 Million Smart Meters Now Live on Diverge Energy Data Platform, Developed by Vector Technology Solutions in Collaboration with AWS",0.13499488,neutral,0.14356022,0.008565335,2023-11-28
2023-11-28 11:27:27,AMZN,Amazon announces new data center chip as Microsoft rivalry intensifies,0.70946044,positive,0.72748595,0.01802549,2023-11-28
2023-11-28 11:26:01,AMZN,AWS Unveils Next Generation AWS-Designed Chips,0.6348442,positive,0.64237976,0.007535594,2023-11-28
2023-11-28 11:18:01,AMZN,AWS Announces the General Availability of Amazon S3 Express One Zone,0.36694166,neutral,0.37494668,0.0080050295,2023-11-28
2023-11-28 10:40:02,AMZN,Amazon : record sales for 'Black Friday,0.73025376,positive,0.74494433,0.014690601,2023-11-28
2023-11-28 09:36:03,AMZN,Amazon : strategic partnership between Eviden and AWS,0.91651624,positive,0.92722946,0.010713247,2023-11-28
2023-11-28 09:08:01,AMZN,"Amazon Hosted Record-Breaking Black Friday and Cyber Monday Holiday Shopping Event, and Announces Millions More Holiday Deals to Come",0.8893877,positive,0.9228901,0.033502392,2023-11-28
2023-11-28 06:48:02,AMZN,Amazon : EU concerned about iRobot acquisition,-0.2731862,neutral,0.1231534,0.3963396,2023-11-28
2023-11-28 06:16:04,AMZN,Amazon Redshift announces new fine-grained access control capabilities to nested objects (preview),0.095511526,neutral,0.10491216,0.009400636,2023-11-28
2023-11-27 16:40:08,AMZN,EU regulators say Amazon's acquisition of vacuum maker iRobot may harm competition,-0.9068558,negative,0.016054407,0.9229102,2023-11-28
2023-11-27 14:58:21,AMZN,Deal-hunters fuel $12 billion Cyber Monday shopping spree,-0.24556056,neutral,0.09522283,0.3407834,2023-11-27
2023-11-27 13:45:02,AMZN,"Amazon Deal for iRobot May Restrict Competition, European Commission Says -- Update",0.13494152,neutral,0.16036707,0.025425551,2023-11-27
2023-11-27 13:29:03,AMZN,European Commission Says Amazon Deal for iRobot May Restrict Competition,0.14308512,neutral,0.26643053,0.12334541,2023-11-27
2023-11-27 13:00:00,AMZN,EU antitrust regulators say Amazon's iRobot deal may restrict competition,-0.80973226,negative,0.033570502,0.8433028,2023-11-27
2023-11-24 10:55:12,AMZN,"Amazon com : How Amazon is using predictive meteorology to help employees and partners make safe, informed decisions this winter",0.12310807,neutral,0.13556823,0.012460162,2023-11-24
2023-11-24 08:05:03,AMZN,"Amazon Faces Black Friday Strikes in US, Europe -- Update",-0.94814706,negative,0.013914681,0.96206176,2023-11-24
2023-11-24 05:51:35,AMZN,"Amazon hit by strikes, protests across Europe during Black Friday trade",-0.9446896,negative,0.015981434,0.960671,2023-11-24
2023-11-23 09:24:02,AMZN,Amazon : strengthens partnership with DXC Technology,0.88654184,positive,0.8942525,0.0077106063,2023-11-24
2023-11-23 05:21:31,AMZN,Amazon to win unconditional EU nod for iRobot deal -sources,0.661481,positive,0.67518085,0.013699858,2023-11-24
2023-11-23 04:37:26,AMZN,EU to approve Amazon's iRobot deal without conditions - sources,0.067457095,neutral,0.0818029,0.0143458005,2023-11-24
2023-11-22 14:51:48,AMZN,Brazil approves $65 million from Amazon Fund to police the rainforest,0.7066014,positive,0.7184695,0.011868121,2023-11-22
2023-11-22 14:07:43,AMZN,"Temu, Shein far lag Amazon as online holiday shopping ramps up",-0.7224147,negative,0.054401107,0.7768158,2023-11-22
2023-11-22 05:11:36,AMZN,"Spain's watchdog clears Amazon, Booking.com, Tripadvisor over fake reviews",-0.53422964,negative,0.03551627,0.5697459,2023-11-22
2023-11-22 01:22:09,AMZN,Handbags At Dawn : Marc Jacobs Hit With New Lawsuit Over Viral TOTE BAG,-0.88827646,negative,0.02658616,0.91486263,2023-11-22
2023-11-22 00:44:05,AMZN,"Black Friday busy as ever, says UK Amazon fulfilment centre boss",-0.9344339,negative,0.018116912,0.95255077,2023-11-22
2023-11-21 11:51:03,AMZN,Jeff Bezos's fund has now given almost $640 million to help homeless families,0.7426549,positive,0.7530701,0.010415181,2023-11-21
2023-11-17 12:40:03,AMZN,Amazon.com to Cut 'Several Hundred' Alexa Jobs,-0.9537687,negative,0.008206257,0.9619749,2023-11-17
2023-11-17 09:17:22,AMZN,"Amazon.com to cut ""several hundred"" Alexa jobs",-0.9545264,negative,0.0073924437,0.9619189,2023-11-17
2023-11-17 06:36:03,AMZN,Amazon : strategic partnership with Hyundai,0.7998995,positive,0.80696845,0.0070689223,2023-11-17
2023-11-17 05:40:59,AMZN,"Amazon eyes $20 bln exports by 2025 from India, says company official",0.8389564,positive,0.8513332,0.012376798,2023-11-17
2023-11-16 19:28:57,AMZN,Amazon aggregator Thrasio prepares for bankruptcy - WSJ,-0.93280435,negative,0.015707107,0.9485115,2023-11-17
2023-11-16 13:08:03,AMZN,"Amazon com : and Hyundai launch a broad, strategic partnership—including vehicle sales on .com in 2024",0.7399233,positive,0.74710363,0.0071803513,2023-11-16
2023-11-16 13:06:08,AMZN,Amazon will allow US customers to buy cars on its site from local car dealers starting next year,0.2505311,neutral,0.26152015,0.010989036,2023-11-16
2023-11-16 10:41:35,AMZN,The Heaven & Earth Grocery Store by James McBride is Amazon's Best Book of 2023,0.15110266,neutral,0.16441146,0.0133087905,2023-11-16
2023-11-16 10:41:31,AMZN,Amazon - Introducing Astro for Business : A Customizable Security Solution Bringing Peace of Mind to Owners of Small and Medium-Sized Businesses,0.4784471,neutral,0.4886216,0.010174491,2023-11-16
2023-11-16 09:12:07,AMZN,Unpacking The CMA's Latest 'Big Tech' Intervention,0.6545164,positive,0.66915405,0.014637657,2023-11-16
2023-11-16 09:06:08,AMZN,"Small business owners call on government to take on Amazon, level playing field",0.21671967,neutral,0.23344623,0.01672655,2023-11-16
2023-11-16 07:14:25,AMZN,Amazon EC2 High Memory instances now available in Europe (London) and Europe (Spain) Regions,0.21478815,neutral,0.22450587,0.009717716,2023-11-16
2023-11-16 07:14:23,AMZN,Amazon EC2 X2iedn instances now available in Europe (Spain) region,0.124939606,neutral,0.13347048,0.008530867,2023-11-16
2023-11-16 05:14:09,AMZN,British Columbia Court Of Appeal Rules That Arbitration Clauses In Standard Form Contracts Are Presumptively Enforceable In The Province,-0.024653457,neutral,0.064551815,0.08920527,2023-11-16
2023-11-16 03:11:03,AMZN,What will the high season for the logistics industry look like this year?,-0.9355575,negative,0.018321717,0.9538792,2023-11-16
2023-11-14 12:41:05,AMZN,Beyond the Suspension : Strategic Recovery for Amazon Sellers,-0.89030087,negative,0.015161528,0.9054624,2023-11-14
2023-11-14 09:05:01,AMZN,Amazon Business’ State of Procurement Report Reveals Key Procurement Strategies for 2024 : Increasing Budgets and Investments in Tech,0.88815427,positive,0.89734894,0.009194702,2023-11-14
2023-11-13 22:12:56,AMZN,Amazon reaches deal to run shopping ads on Snap - The Information,0.24191014,neutral,0.25219753,0.010287396,2023-11-14
2023-11-13 12:38:25,AMZN,"Amazon cuts jobs in Games unit, part of broader restructuing",-0.96553135,negative,0.0075955307,0.9731269,2023-11-13
2024-10-29 16:59:40,TSLA,Elon Musk wins court victory in a dispute over a 2018 post during a labor dispute,-0.93786055,negative,0.014560319,0.9524209,2024-10-28
2024-10-29 12:45:30,TSLA,What happens as EU concludes investigation of Chinese-made EVs?,-0.2676161,negative,0.2481284,0.5157445,2024-10-28
2024-10-29 12:14:56,TSLA,Musk Says He Sees Low Population Growth as a Key Risk,0.17044136,neutral,0.1995219,0.029080544,2024-10-28
2024-10-29 08:56:12,TSLA,Lucid to open orders for Gravity electric SUV next week,0.885453,positive,0.8958098,0.0103568565,2024-10-28
2024-10-28 06:06:59,TSLA,"Musk's bold 2025 prediction on Tesla sales faces skepticism, scrutiny",0.91499615,positive,0.9306796,0.015683446,2024-10-28
2024-10-28 02:21:05,TSLA,MUSK BE LOVE: ELON STUMPS FOR TRUMP,0.17341092,neutral,0.19514376,0.021732833,2024-10-28
2024-10-27 06:02:02,TSLA,Trump to kick off final week of campaign with Madison Square Garden rally,0.4417237,neutral,0.47658986,0.034866154,2024-10-28
2024-10-26 17:55:57,TSLA,Washington Post reports Elon Musk briefly worked illegally in US in 1990s,-0.4054907,neutral,0.035348926,0.44083962,2024-10-28
2024-10-26 11:01:05,TSLA,Tesla closes trading week convincingly in the green after impressive quarterly results,0.9276928,positive,0.944183,0.016490217,2024-10-28
2024-10-25 13:22:06,TSLA,Here's a look at Musk's contact with Putin and why it matters,0.034347095,neutral,0.061970986,0.027623892,2024-10-25
2024-10-25 11:01:29,TSLA,"Pomerantz Law Firm Investigates Claims On Behalf of Investors of Tesla, Inc. - TSLA",-0.012129776,neutral,0.025110211,0.037239987,2024-10-25
2024-10-24 17:56:32,TSLA,Tesla's Slower Autonomous Rollout,0.9407146,positive,0.95774317,0.017028563,2024-10-25
2024-10-24 17:56:03,TSLA,Truist's Stein: Tesla FSD Is Amazing Tech But Has Failures,0.93492246,positive,0.9510791,0.01615664,2024-10-25
2024-10-24 10:21:25,TSLA,Stock market today: Wall Street steadies after 3 down days as Tesla surges,0.9034326,positive,0.9387374,0.03530479,2024-10-24
2024-10-24 09:38:25,TSLA,Stock market today: Wall Street holds steadier as Tesla surges,0.9087124,positive,0.9411275,0.032415085,2024-10-24
2024-10-24 09:12:12,TSLA,Very Surprised By Tesla's Quarter: Tom Narayan,0.9353605,positive,0.95174605,0.016385581,2024-10-24
2024-10-24 08:13:42,TSLA,"China to Drive Tesla Vehicle Delivery Growth, Says Ives",0.044585988,neutral,0.06970931,0.02512332,2024-10-24
2024-10-24 06:03:21,TSLA,Tesla : EPS up 9% in Q3,0.93280965,positive,0.95583993,0.02303029,2024-10-24
2024-10-24 04:14:57,TSLA,"Tesla allays investor fears with crucial EV growth forecast, shares jump",0.9305282,positive,0.9518671,0.021338882,2024-10-24
2024-10-24 02:31:03,TSLA,Tesla shares pop 12% in Frankfurt on strong sales forecast,0.93409336,positive,0.9533222,0.019228805,2024-10-24
2024-10-23 23:36:23,TSLA,Tesla shares soar after surprise strong sales and rosy forecast,0.9314774,positive,0.9494728,0.01799534,2024-10-24
2024-10-23 22:46:30,TSLA,Asia shares fall on US election anxiety; Tesla earnings provide some cheer,-0.94989115,negative,0.018323408,0.9682146,2024-10-24
2024-10-23 17:58:25,TSLA,Tech Down as AI Craze Cools -- Tech Roundup,-0.952531,negative,0.0121429,0.9646739,2024-10-24
2024-10-23 17:49:58,TSLA,Breaking Down Tesla's Better-Than-Expected Results,0.78622705,positive,0.8682226,0.08199554,2024-10-24
2024-10-23 17:01:45,TSLA,"Tesla posts surprise $2.17 billion third-quarter profit, up 17.3% from a year ago",0.9361855,positive,0.95727766,0.021092186,2024-10-24
2024-10-23 16:14:05,TSLA,Tesla Releases Third Quarter 2024 Financial Results,-0.001233479,neutral,0.023175688,0.024409167,2024-10-24
2024-10-23 16:07:48,TSLA,Tesla's third-quarter profit margin beats estimates,0.9251541,positive,0.9531382,0.0279841,2024-10-24
2024-10-23 16:06:09,TSLA,Tesla : Q3'24 Earnings Update Letter,0.0021140538,neutral,0.030849503,0.02873545,2024-10-24
2024-10-23 16:04:29,TSLA,"Justice Dept warns Musk's super PAC over million dollar giveaways, CNN reports",-0.884044,negative,0.019623859,0.90366787,2024-10-24
2024-10-23 09:21:54,TSLA,Tesla Set to Report 3Q Results: What to Expect,-0.9612254,negative,0.008161446,0.9693868,2024-10-23
2024-10-22 05:02:07,TSLA,"Elon Musk delivers cash, conspiracies to Pennsylvania voters",0.12379299,neutral,0.15161198,0.027818995,2024-10-22
2024-10-22 02:16:10,TSLA,Musk And Dogecoin Investors Go Another Round: Post-Dismissal Sanctions Motions In Dogecoin Class Action,-0.83649445,negative,0.030587249,0.8670817,2024-10-22
2024-10-21 17:58:12,TSLA,Consumer Cos Down Amid Holiday-Shopping Nerves -- Consumer Roundup,-0.6730062,negative,0.1524271,0.82543325,2024-10-22
2024-10-21 17:51:07,TSLA,"'Blade Runner 2049' producer sues Tesla, Warner Bros over AI images",-0.86007714,negative,0.017748801,0.8778259,2024-10-22
2024-10-19 22:57:03,TSLA,Elon Musk promises to award $1 million each day to a signer of his petition,0.13515243,neutral,0.15542468,0.020272262,2024-10-21
2024-10-18 12:06:16,TSLA,Safety of Tesla self-driving capabilities facing federal investigation,0.12971136,neutral,0.15432775,0.024616387,2024-10-18
2024-10-18 07:48:34,TSLA,U.S. Auto Regulator Investigating Tesla's Self-Driving Tech After Fatal Accident,-0.7224611,negative,0.0285562,0.75101733,2024-10-18
2024-10-18 07:16:05,TSLA,US to probe Tesla's 'Full Self-Driving' system after pedestrian killed in low visibility conditions,-0.7500846,negative,0.062089168,0.8121737,2024-10-18
2024-10-18 07:03:39,TSLA,"Indonesia to export EV battery material to US next month, minister says",0.39558998,neutral,0.4079083,0.012318327,2024-10-18
2024-10-17 15:49:05,TSLA,"Pomerantz Law Firm Investigates Claims On Behalf of Investors of Tesla, Inc. - TSLA",-0.012400251,neutral,0.02512161,0.03752186,2024-10-17
2024-10-16 17:50:00,TSLA,"Stocks to Watch : Tesla, CSX, Alcoa",0.23979798,neutral,0.25712088,0.017322894,2024-10-17
2024-10-16 00:06:05,TSLA,Unions face a moment of truth in Michigan in this year's presidential race,-0.57752854,negative,0.10932566,0.6868542,2024-10-16
2024-10-14 05:54:42,TSLA,Tesla's Cybercab Reveal Gets Cool Reception,0.77943456,positive,0.799278,0.019843463,2024-10-14
2024-10-14 05:04:23,TSLA,UK Tech Secretary Kyle denies slashing red tape will lower standards,-0.23342434,negative,0.18967557,0.4230999,2024-10-14
2024-10-14 01:01:13,TSLA,Tesla lunges into autonomous parcel shipping,0.03663905,neutral,0.05264176,0.01600271,2024-10-14
2024-10-12 06:05:03,TSLA,"Tesla's sporty, two-seater robotaxi design puzzles experts",-0.011257082,neutral,0.17576279,0.18701987,2024-10-14
2024-10-11 17:54:13,TSLA,"Tech Up, Testing All-Time Highs, After Inflation Data -- Tech Roundup",-0.9018497,negative,0.042440094,0.9442898,2024-10-14
2024-10-11 16:14:37,TSLA,"Why Tesla's robotaxi stalled and shares of Uber, Lyft zoomed",-0.9578151,negative,0.010197558,0.9680127,2024-10-14
2024-10-11 14:40:10,TSLA,"Snubbed by Tesla, Mexican government pledges to create its own small, affordable electric car",0.7045735,positive,0.7234414,0.018867893,2024-10-11
2024-10-11 12:17:48,TSLA,"Musk Shows Tesla Cybercab, Sees 2026 Debut",0.04382872,neutral,0.06969165,0.025862934,2024-10-11
2024-10-11 09:56:08,TSLA,"Stock market today: Wall Street hangs near records as banks rally, Tesla tumbles",0.08100939,positive,0.5275717,0.4465623,2024-10-11
2024-10-11 09:29:19,TSLA,"Lot of sci-fi smoke and mirrors: Investors, experts react to Tesla's robotaxi unveil",-0.92188984,negative,0.021001844,0.94289166,2024-10-11
2024-10-11 09:27:06,TSLA,Tesla shares fall in premarket trading after Cybercab introduction,-0.96650213,negative,0.008470306,0.9749724,2024-10-11
2024-10-11 07:44:52,TSLA,Swedish court upholds ruling against Tesla in labour dispute,-0.9321786,negative,0.016453993,0.9486326,2024-10-11
2024-10-11 05:04:14,TSLA,Tesla unveils revolutionary robotic cab prototype Cybercab,0.7570236,positive,0.7653875,0.008363881,2024-10-11
2024-10-11 04:23:25,TSLA,"Tesla robotaxi event was long on promises, but investors wanted more details",0.054485183,neutral,0.088986196,0.034501012,2024-10-11
2024-10-09 11:47:08,TSLA,Musk's X back online to some Brazil users after suspension lifted,0.20603372,positive,0.44010955,0.23407583,2024-10-09
2024-10-09 07:15:28,TSLA,Tesla's China-made EV sales grow 19.2% y/y in Sept,0.93578523,positive,0.954337,0.018551746,2024-10-09
2024-10-08 20:56:05,TSLA,"Tesla's investment in Mexico will be decided after US elections, says Governor Garcia",0.08723371,neutral,0.099767126,0.012533415,2024-10-09
2024-10-07 09:07:01,TSLA,Lucid beats quarterly deliveries estimate as price discounts boost demand,0.9335836,positive,0.95457757,0.020993955,2024-10-07
2024-10-05 13:06:04,TSLA,Waymo partners with Hyundai to integrate IONIQ 5 SUVs into Robot Taxi fleet,0.5794963,positive,0.5879531,0.008456771,2024-10-07
2024-10-04 11:01:05,TSLA,Tesla robot cabs and their safety: a twilight zone?,-0.26868725,neutral,0.03674842,0.30543566,2024-10-04
2024-10-04 05:09:42,TSLA,"EU vote on Chinese EV tariffs inconclusive, leaving EU Commission to decide, EU sources says",-0.80555034,negative,0.043730024,0.84928036,2024-10-04
2024-10-04 02:34:45,TSLA,Musk to attend Trump rally in Pennsylvania at site of July assassination attempt,0.044838317,neutral,0.065581575,0.020743258,2024-10-04
2024-10-03 21:02:29,TSLA,EU governments face pivotal vote on Chinese EV tariffs,0.22599798,positive,0.42080277,0.19480479,2024-10-04
2024-10-03 14:24:27,TSLA,"Tesla plans $800 million debt sale backed by prime leases, Bloomberg News reports",0.5802562,positive,0.602047,0.021790804,2024-10-03
2024-10-03 10:42:50,TSLA,"Tesla plans four new batteries in 2026, including for robotaxi, The Information reports",0.24023981,neutral,0.25244975,0.012209933,2024-10-03
2024-10-03 10:28:26,TSLA,Swedish union files lawsuit against Tesla over labour conflict,-0.95207494,negative,0.008821694,0.9608966,2024-10-03
2024-10-03 09:52:18,TSLA,"A 5th recall for Tesla Cybertruck within a year, the latest due to rearview display",-0.9504213,negative,0.010162479,0.96058375,2024-10-03
2024-10-03 08:44:07,TSLA,"Tesla issues 5th recall for the new Cybertruck within a year, the latest due to rearview camera",-0.9366022,negative,0.012871554,0.94947374,2024-10-03
2024-10-03 08:04:09,TSLA,US offers EVgo conditional $1.05 billion loan for EV chargers,0.8845179,positive,0.8924806,0.00796271,2024-10-03
2024-10-03 06:04:26,TSLA,"Uber, Lyft drivers use Teslas as makeshift robotaxis, raising safety concerns",-0.7937441,negative,0.0343942,0.8281383,2024-10-03
2024-10-03 05:47:08,TSLA,"Tesla to recall over 27,000 Cybertruck vehicles, NHTSA says",-0.93933785,negative,0.013341933,0.95267975,2024-10-03
2024-10-02 20:03:13,TSLA,"Stocks to Watch : Levi Strauss, Caesars Entertainment, Tesla",-0.9410561,negative,0.024337957,0.965394,2024-10-03
2024-10-02 15:02:51,TSLA,Tesla's Sales Gain Comes Up Short,0.92207265,positive,0.9452445,0.02317185,2024-10-02
2024-10-02 14:30:10,TSLA,Trending : Tesla 3Q Deliveries Meet Expectations,0.656865,positive,0.6759734,0.019108443,2024-10-02
2024-10-02 13:01:59,TSLA,"Tesla misses Q3 delivery estimates, shares fall",-0.958776,negative,0.01181754,0.9705935,2024-10-02
2024-10-02 10:24:17,TSLA,"Tesla: deliveries up, but considered disappointing",0.9013155,positive,0.9424827,0.041167222,2024-10-02
2024-10-02 09:48:09,TSLA,"Tesla posts first quarterly increase in deliveries, but shares slump with investors hoping for more",0.76843345,positive,0.8739399,0.10550642,2024-10-02
2024-10-02 09:20:06,TSLA,"Tesla's global deliveries rose in Q3, first increase this year for the electric vehicle maker",0.9429394,positive,0.9566974,0.0137580205,2024-10-02
2024-10-02 09:13:50,TSLA,"Tesla : Third Quarter 2024 Production, Deliveries & Deployments Form 8 K",0.06386941,neutral,0.079612315,0.015742907,2024-10-02
2024-10-02 09:13:02,TSLA,"Tesla Third Quarter 2024 Production, Deliveries & Deployments",0.13361998,neutral,0.14381467,0.010194692,2024-10-02
2024-10-02 09:07:03,TSLA,Tesla reports third-quarter deliveries below estimates,-0.9586039,negative,0.01220192,0.9708058,2024-10-02
2024-10-02 08:18:13,TSLA,"France, Greece, Italy, Poland set to back Chinese EV tariffs, sources say",0.8200065,positive,0.8373869,0.017380396,2024-10-02
