datetime,ticker,headline,sent_compound,sent_label,sent_positive,sent_negative,trading_day
2024-03-18 17:16:22,GOOGL,News Highlights : Top Company News of the Day - Monday at 5 PM ET,-0.75277746,negative,0.0821859,0.8349634,2024-03-19
2024-03-18 16:00:35,GOOGL,"Wall Street ends higher, investors juggle Fed nerves with AI enthusiasm",0.8638851,positive,0.9141325,0.05024737,2024-03-19
2024-03-18 15:16:31,GOOGL,News Highlights : Top Company News of the Day - Monday at 3 PM ET,0.08532586,neutral,0.10041244,0.015086587,2024-03-18
2024-03-18 13:18:22,GOOGL,News Highlights : Top Company News of the Day - Monday at 1 PM ET,0.08559402,neutral,0.10053031,0.014936289,2024-03-18
2024-03-18 10:52:36,GOOGL,Alphabet: rumors of a Google-Apple partnership in AI,0.6382474,positive,0.6728227,0.034575313,2024-03-18
2024-03-18 06:45:12,GOOGL,"Apple in Talks to Use Google AI in IPhones, Bloomberg Reports",0.43238544,neutral,0.4457375,0.013352059,2024-03-18
2024-03-18 06:35:41,GOOGL,Google Malaysia Apologizes for Misquoting Ringgit Exchange Rate,-0.8741631,negative,0.026767205,0.9009303,2024-03-18
2024-03-18 04:23:42,GOOGL,Google Malaysia apologises for misquoting ringgit exchange rate,-0.9300362,negative,0.020587299,0.9506235,2024-03-18
2024-03-15 08:48:03,GOOGL,India antitrust body orders probe into Google's billing dispute,-0.91268104,negative,0.021407913,0.93408895,2024-03-15
2024-03-14 20:50:57,GOOGL,US agency probes risks of foreign satellite use by handheld devices,-0.2617491,neutral,0.049676403,0.31142548,2024-03-15
2024-03-14 14:49:15,GOOGL,Will TikTok be banned in the US and what is next for the bill?,0.018613212,neutral,0.060152534,0.041539323,2024-03-14
2024-03-14 05:16:05,GOOGL,"Crypto Surge: Bitcoin (BTC) Hits $72,000 Eclipsing Alphabet Inc. (NASDAQ",0.5695382,positive,0.59058756,0.021049406,2024-03-14
2024-03-13 15:05:53,GOOGL,White House urges U.S. Senate to take swift action on TikTok bill,0.5795908,positive,0.6408347,0.06124389,2024-03-13
2024-03-13 11:38:16,GOOGL,Waymo Says Fully Autonomous Ride-Hailing Service Available In LA From March 14,0.10336399,neutral,0.11205924,0.008695249,2024-03-13
2024-03-13 02:00:00,GOOGL,"Methane emissions from energy sector near record high in 2023, IEA says",0.8065439,positive,0.84864485,0.042100973,2024-03-13
2024-03-12 18:31:03,GOOGL,US House to vote on TikTok crackdown; fate uncertain in Senate,-0.012629777,neutral,0.075204685,0.08783446,2024-03-13
2024-03-12 17:04:13,GOOGL,Equinix Taps Google Executive as Next CEO Amid Leadership Transition,0.19320649,neutral,0.2055425,0.01233602,2024-03-13
2024-03-12 07:09:06,GOOGL,Collective Audience BeOp Acquisition Enhances Revenue Generating Reach Into $839 Billion Adtech Market ($CAUD),0.4855122,positive,0.49670961,0.011197419,2024-03-12
2024-03-11 02:03:45,GOOGL,Analysis-AI talent war heats up in Europe,-0.8373294,negative,0.034782078,0.87211144,2024-03-11
2024-03-11 00:27:31,GOOGL,US aims to be 'economic partner of choice' for Indo-Pacific- Raimondo,0.78170276,positive,0.7915955,0.009892772,2024-03-11
2024-03-07 09:16:08,GOOGL,News Highlights : Top Company News of the Day - Thursday at 9 AM ET,0.7324502,positive,0.7540834,0.021633187,2024-03-07
2024-03-07 08:13:04,GOOGL,"Alphabet : Webcast & transcript link for Philipp Schindler, Senior Vice President and Chief Business Officer of Google at the Morgan Stanley Technology, Media and Telecom Conference on March 6th, 2024",0.005675683,neutral,0.025201347,0.019525664,2024-03-07
2024-03-07 07:16:20,GOOGL,News Highlights : Top Company News of the Day - Thursday at 7 AM ET,0.84285164,positive,0.84981424,0.0069626025,2024-03-07
2024-03-07 05:16:08,GOOGL,News Highlights : Top Company News of the Day - Thursday at 5 AM ET,-0.005519718,negative,0.48584956,0.49136928,2024-03-07
2024-03-07 03:16:23,GOOGL,News Highlights : Top Company News of the Day - Thursday at 3 AM ET,-0.3808216,negative,0.29997706,0.68079865,2024-03-07
2024-03-07 01:16:10,GOOGL,News Highlights : Top Company News of the Day - Thursday at 1 AM ET,-0.90352565,negative,0.041860633,0.9453863,2024-03-07
2024-03-06 23:16:06,GOOGL,News Highlights : Top Company News of the Day - Wednesday at 11 PM ET,0.19486043,neutral,0.21020035,0.015339924,2024-03-07
2024-03-06 15:45:53,GOOGL,Former Google engineer indicted for stealing AI secrets to aid Chinese companies,-0.8573482,negative,0.022214536,0.87956274,2024-03-06
2024-03-05 14:34:05,GOOGL,Court Backs Tech Companies in Cobalt Mining Forced Labor Case,-0.77105534,negative,0.05329558,0.8243509,2024-03-05
2024-03-05 12:07:35,GOOGL,Lawmakers seek to force ByteDance to divest TikTok or face US ban,0.05290808,neutral,0.112590306,0.059682224,2024-03-05
2024-03-05 05:01:48,GOOGL,"Google agrees to restore deleted Indian apps, IT minister says",-0.2720711,negative,0.17454967,0.44662076,2024-03-05
2024-03-04 18:30:00,GOOGL,Indian startups ask antitrust body to order Google to restore apps after 'brazen' move,-0.87327296,negative,0.029767115,0.90304005,2024-03-05
2024-02-29 12:17:06,GOOGL,Canada Antitrust Watchdog to Expand Probe Into Google's Advertising Practices -- Update,0.14507803,neutral,0.17837015,0.033292107,2024-02-29
2024-02-29 11:52:11,GOOGL,Canada Antitrust Watchdog to Expand Probe Into Google's Advertising Practices,0.17430356,neutral,0.21795422,0.04365065,2024-02-29
2024-02-28 17:27:06,GOOGL,Tech Stumbles as AI Rally Stalls -- Tech Roundup,-0.95267403,negative,0.012730012,0.96540403,2024-02-29
2024-02-28 13:36:05,GOOGL,"Axel Springer, Other European Media Sue Google For $2.3 Billion -- Update",-0.94864774,negative,0.013543144,0.96219087,2024-02-28
2024-02-28 13:10:09,GOOGL,"Axel Springer, Other European Media Sue Google For $2.3 Billion",-0.9503371,negative,0.0129372,0.9632743,2024-02-28
2024-02-28 04:20:31,GOOGL,"Google working to fix Gemini AI as CEO calls some responses ""unacceptable""",-0.9281327,negative,0.011432759,0.9395655,2024-02-28
2024-02-22 05:11:28,GOOGL,Google to pause Gemini AI model's image generation of people,-0.3266077,neutral,0.021493338,0.34810105,2024-02-22
2024-02-21 12:35:02,GOOGL,California suspends Waymo's application to expand to parts of LA and SF's peninsula,-0.9419538,negative,0.008921887,0.95087564,2024-02-21
2024-02-21 06:22:05,GOOGL,EU Commission eyes centralised spectrum policy in telecoms market revamp,0.62496334,positive,0.6339781,0.009014805,2024-02-21
2024-02-20 08:05:00,GOOGL,US House forms AI task force as legislative push stalls,0.17591424,neutral,0.19133352,0.015419277,2024-02-20
2024-02-16 08:28:06,GOOGL,Alphabet: Google further strengthens cybersecurity with AI,0.86050093,positive,0.8682051,0.007704151,2024-02-16
2024-02-15 19:01:00,GOOGL,Google to launch anti-misinformation campaign ahead of EU elections,0.34637547,neutral,0.36592653,0.019551067,2024-02-16
2024-02-15 05:33:17,GOOGL,Waymo updates software for over 400 recalled vehicles - NHTSA,0.056343064,neutral,0.07853972,0.022196656,2024-02-15
2024-02-14 15:56:01,GOOGL,"Tinder, other Match dating apps encourage compulsive use, lawsuit claims",-0.81102365,negative,0.028508365,0.839532,2024-02-14
2024-02-14 10:53:05,GOOGL,Alphabet: a new Google hub inaugurated tomorrow in Paris,0.24908376,neutral,0.25862175,0.009538,2024-02-14
2024-02-14 09:42:13,GOOGL,Nvidia outstrips Alphabet as third largest US company by market value,0.8860009,positive,0.91896003,0.03295916,2024-02-14
2024-02-12 16:52:10,GOOGL,US judge blocks Ohio law restricting children's use of social media,-0.70016015,negative,0.039797384,0.7399575,2024-02-13
2024-02-09 11:53:03,GOOGL,TikTok loses court fight to suspend EU gatekeeper status,-0.9342507,negative,0.0203208,0.9545715,2024-02-09
2024-02-08 08:12:33,GOOGL,EU drafts guidelines as it urges Big Tech to protect democratic elections,0.14328696,neutral,0.18031152,0.03702456,2024-02-08
2024-02-08 05:00:00,GOOGL,US says leading AI companies join safety consortium to address risks,0.7000811,positive,0.7096811,0.009600011,2024-02-08
2024-02-07 15:49:55,GOOGL,Waymo robotaxi accident with San Francisco cyclist draws regulatory review,-0.73952544,negative,0.025896301,0.76542175,2024-02-07
2024-02-06 16:07:20,GOOGL,"Spate of job cuts continues unabated at Big Tech, media firms",-0.95813507,negative,0.010952685,0.9690878,2024-02-07
2024-02-06 12:38:05,GOOGL,"Google Agrees to Pay $350 Million to Settle Personal Data Breach Lawsuit, Washington Post Reports",0.09663072,positive,0.48279518,0.38616446,2024-02-06
2024-02-01 10:25:10,GOOGL,Big Tech move into finance to come under closer EU scrutiny,0.08350323,neutral,0.131835,0.048331767,2024-02-01
2024-02-01 01:30:00,GOOGL,Google signs its largest offshore power agreement with Dutch wind projects,0.9209504,positive,0.93294734,0.011996943,2024-02-01
2024-01-31 17:32:04,GOOGL,Tech Down After AI Earnings Disappointment -- Tech Roundup,-0.9662565,negative,0.007705499,0.973962,2024-02-01
2024-01-31 06:03:22,GOOGL,"Nasdaq futures sink as Alphabet, Microsoft disappoint; Fed decision in focus",-0.9630001,negative,0.009557239,0.97255737,2024-01-31
2024-01-31 05:02:47,GOOGL,Alphabet is in a league of its own,0.2629802,neutral,0.29122734,0.028247153,2024-01-31
2024-01-31 03:37:03,GOOGL,Alphabet: EPS up 56% in Q4,0.94008636,positive,0.95518637,0.015100009,2024-01-31
2024-01-30 22:14:31,GOOGL,"Pacific Islands need to boost digital security to join undersea cable, says US official",0.8358429,positive,0.845466,0.009623083,2024-01-31
2024-01-26 12:08:11,GOOGL,"Big Tech, media firms start off 2024 with fresh U.S. job cuts",-0.9526741,negative,0.013673031,0.9663471,2024-01-26
2024-01-26 05:16:07,GOOGL,News Highlights : Top Global Markets News of the Day - Friday at 5 AM ET,0.07135734,neutral,0.22020605,0.14884871,2024-01-26
2024-01-26 03:16:20,GOOGL,News Highlights : Top Global Markets News of the Day - Friday at 3 AM ET,-0.9416039,negative,0.016108066,0.957712,2024-01-26
2024-01-26 01:16:07,GOOGL,News Highlights : Top Global Markets News of the Day - Friday at 1 AM ET,-0.8946411,negative,0.03701567,0.9316568,2024-01-26
2024-01-25 23:16:17,GOOGL,News Highlights : Top Global Markets News of the Day - Thursday at 11 PM ET,-0.6751829,negative,0.02995087,0.70513374,2024-01-26
2024-01-25 21:16:18,GOOGL,News Highlights : Top Global Markets News of the Day - Thursday at 9 PM ET,-0.788789,negative,0.091819,0.88060796,2024-01-26
2024-01-24 14:45:21,GOOGL,Battery startup Sion Power raises $75 mln in funding round led by LG Energy Solutions,0.87927735,positive,0.888171,0.008893648,2024-01-24
2024-01-24 14:01:08,GOOGL,Google to Settle Chip Patent Lawsuit With Singular Computing,-0.47237855,negative,0.05433667,0.5267152,2024-01-24
2024-01-24 11:28:08,GOOGL,"Alphabet: in green, a broker raises its price target",0.9201162,positive,0.93379456,0.013678356,2024-01-24
2024-01-24 08:17:07,GOOGL,Alphabet: price target raised by Jefferies,0.92762566,positive,0.94945717,0.021831505,2024-01-24
2024-01-22 13:47:25,GOOGL,"'Outrageous' CEO pay targeted in new bill from Bernie Sanders, US Democrats",-0.5295586,negative,0.10199417,0.63155276,2024-01-22
2024-01-22 11:18:16,GOOGL,"Alphabet Division X Cutting Dozens of Staff, Bloomberg Reports",-0.9569828,negative,0.010377287,0.9673601,2024-01-22
2024-01-19 22:55:50,GOOGL,Waymo seeks to extend driverless deployment service to Los Angeles,0.86498994,positive,0.8731762,0.008186299,2024-01-22
2024-01-18 13:37:09,GOOGL,Google to Invest $1 Billion to Build UK Data Center,0.10292433,neutral,0.111982375,0.009058045,2024-01-18
2024-01-17 10:02:33,GOOGL,Google to tweak search results to comply with EU tech rules,0.61334217,positive,0.6252898,0.011947648,2024-01-17
2024-01-16 10:44:24,GOOGL,Google lays off hundreds of employees in advertising team - Business Insider,-0.9359727,negative,0.00922989,0.9452026,2024-01-16
2024-01-11 14:40:22,GOOGL,US political ad spending to soar in 2024 with TV media the biggest winner - report,0.9048439,positive,0.9265305,0.02168654,2024-01-11
2024-01-11 01:20:06,GOOGL,"Google lays off hundreds working on Assistant, hardware, AR teams",-0.93682355,negative,0.010782435,0.94760597,2024-01-11
2024-01-09 12:48:37,GOOGL,Google faces $1.67 bln damages demand at AI-related patent trial,-0.8570757,negative,0.037088335,0.894164,2024-01-09
2024-01-08 23:10:03,GOOGL,Big Tech rebuffs US consumer watchdog plans to supervise digital wallets,-0.9366133,negative,0.013234122,0.94984746,2024-01-09
2024-01-08 02:43:28,GOOGL,"India's Modi to lure tech, EV investments at Gujarat summit as poll looms",0.1506624,neutral,0.16768557,0.017023167,2024-01-08
2024-01-05 06:56:08,GOOGL,EU's Vestager to meet Big Tech CEOs in the US next week,0.068287335,neutral,0.080137625,0.011850289,2024-01-05
2024-01-03 06:03:12,GOOGL,Generative AI's wild 2023,0.7324246,positive,0.7438094,0.011384787,2024-01-03
2023-12-29 17:20:18,GOOGL,Hershey is sued over lack of artistic detail on Reese's candies,-0.94182,negative,0.010815438,0.95263547,2024-01-02
2023-12-21 04:37:25,GOOGL,India antitrust body selects Pattnaik as investigations head -sources,0.115155704,neutral,0.1302728,0.015117101,2023-12-21
2023-12-20 14:08:36,GOOGL,US proposes more limits on making money off children's data,-0.10095285,neutral,0.057073295,0.15802614,2023-12-20
2023-12-19 20:04:53,GOOGL,Google plans ad sales restructuring as automation booms - The Information,-0.04095246,neutral,0.028528789,0.069481246,2023-12-20
2023-12-19 18:23:06,GOOGL,Tech Up as Speculative Euphoria Prevails -- Tech Roundup,0.90598243,positive,0.9252407,0.01925828,2023-12-20
2023-12-19 14:59:05,GOOGL,Trending : Alphabet to Pay $700 Million in Google Play Settlement,0.46018293,positive,0.5723831,0.11220017,2023-12-19
2023-12-15 03:53:15,GOOGL,Britain weighs new consultation on social media impact on teens,0.71676,positive,0.73370504,0.016945086,2023-12-15
2023-12-14 20:15:32,GOOGL,Google to test new feature limiting advertisers' use of browser tracking cookies,-0.09252215,neutral,0.063724734,0.15624689,2023-12-15
2023-12-14 08:49:09,GOOGL,Spain readies age-checking tech to protect children from adult online content,0.09361671,neutral,0.11748347,0.02386676,2023-12-14
2023-12-14 07:05:02,GOOGL,Alphabet : EU requests information from Google,0.13357966,neutral,0.14408045,0.010500786,2023-12-14
2023-12-13 10:00:00,GOOGL,Google Cloud partners with Mistral AI on generative language models,0.70595145,positive,0.71395504,0.008003603,2023-12-13
2023-12-13 08:00:00,GOOGL,"Google Ventures adds partner to back AI, open source startups",0.7520363,positive,0.7600296,0.007993317,2023-12-13
2023-12-12 13:56:04,GOOGL,Epic Games verdict adds to Google's global antitrust woes,0.25027785,positive,0.6049611,0.35468325,2023-12-12
2023-12-12 10:36:02,GOOGL,Trending : Epic Games Wins Antitrust Lawsuit Against Google,-0.59364855,negative,0.086516686,0.68016523,2023-12-12
2023-12-12 10:29:12,GOOGL,"Italy fines YouTube, Twitch for allegedly breaching gamble ads ban",-0.94149876,negative,0.011214333,0.9527131,2023-12-12
2023-12-12 06:05:44,GOOGL,Futures edge higher with all eyes on inflation data,0.3634182,positive,0.6444099,0.2809917,2023-12-12
2023-12-07 18:42:42,GOOGL,Alphabet and AMD fuel rise in Nasdaq,0.9143386,positive,0.9428572,0.028518593,2023-12-08
2023-12-07 14:37:19,GOOGL,Alphabet and AMD fuel AI rally on Nasdaq,0.92443526,positive,0.9458793,0.021444015,2023-12-07
2023-12-07 12:10:20,GOOGL,Italy toughens rules on video-sharing platforms to protect minors,0.7256805,positive,0.78543043,0.05974994,2023-12-07
2023-12-07 12:05:50,GOOGL,Musk says his AI firm xAI is rolling out chatbot Grok to X Premium+ subscribers,0.14055212,neutral,0.14932713,0.008775005,2023-12-07
2023-12-07 10:08:23,GOOGL,Alphabet soars as Wall Street cheers arrival of AI model Gemini,0.92726636,positive,0.9441177,0.016851362,2023-12-07
2023-12-06 14:18:06,GOOGL,"Alphabet : Webcast & transcript link for Will Grannis, CTO, Google Cloud at the Scotiabank Global Technology Conference on December 5th, 2023",0.0057191066,neutral,0.025745105,0.020025998,2023-12-06
2023-11-29 19:01:00,GOOGL,Tech companies to sign agreement with UK government to tackle online fraud,0.83072907,positive,0.8461767,0.015447593,2023-11-30
2023-11-29 14:51:03,GOOGL,"Google, Canada Reach Deal Over Planned Online News Law",0.25231412,positive,0.5475884,0.2952743,2023-11-29
2023-11-29 12:09:03,GOOGL,"Google, Canadian Government Reach Deal on Online News Act, CBC Reports",-0.6792283,negative,0.10559609,0.7848244,2023-11-29
2023-11-29 11:00:00,GOOGL,Google DeepMind AI reveals potential for thousands of new materials,0.29613194,neutral,0.30587512,0.009743184,2023-11-29
2023-11-22 15:20:37,GOOGL,ICBC partners wary to resume trading with bank after cyberattack - Bloomberg News,-0.9188474,negative,0.021800134,0.94064754,2023-11-22
2023-11-22 12:56:28,GOOGL,EU lawmakers back rules forcing Big Tech to tackle child pornography,-0.14867468,neutral,0.1275949,0.27626958,2023-11-22
2023-11-20 23:10:24,GOOGL,OpenAI's board approached Anthropic CEO about top job and merger - sources,-0.4105407,neutral,0.04049896,0.45103967,2023-11-21
2023-11-20 20:34:19,GOOGL,OpenAI approached Anthropic about merger - The Information,-0.10956009,neutral,0.08375813,0.19331822,2023-11-21
2023-11-18 08:59:40,GOOGL,"Ousted OpenAI CEO Altman welcome in France, minister says",-0.7281053,negative,0.023781653,0.75188696,2023-11-20
2023-11-16 19:09:55,GOOGL,Google Delays Release Of Gemini AI That Aims To Compete With OpenAI- The Information,-0.8248449,negative,0.015037334,0.83988225,2023-11-17
2023-11-16 17:00:18,GOOGL,What's next in Google's court battle with the US Justice Department?,-0.33508185,neutral,0.07692605,0.4120079,2023-11-17
2023-11-15 20:35:37,GOOGL,"Malaysia, Google announce strategic collaboration on skills opportunities - state news agency",0.79424506,positive,0.8021033,0.007858213,2023-11-16
2023-11-15 01:06:48,GOOGL,"Thailand to receive $8.5 bln worth of investment from AWS, Google, Microsoft",0.4954528,positive,0.5060607,0.010607941,2023-11-15
2023-11-14 12:33:15,GOOGL,"Meta, Alphabet, ByteDance, Snap must face social media addiction lawsuits",-0.8689856,negative,0.020386288,0.8893719,2023-11-14
2023-11-14 12:07:58,GOOGL,Judge says social media companies must face lawsuits over harm to children,-0.92164296,negative,0.016097082,0.93774,2023-11-14
2024-10-29 11:35:05,AMZN,Amazon com : AWS powers CelcomDigi’s transformation into an AI Driven Telco Tech Company,0.7915305,positive,0.79894084,0.007410365,2024-10-28
2024-10-29 11:27:12,AMZN,"Amazon com : How 3 small businesses used PartyRock, a free generative AI tool from AWS, to help customers",0.052824907,neutral,0.06772517,0.014900259,2024-10-28
2024-10-29 04:16:07,AMZN,4 pros and cons to a Trump or Harris win for UK businesses,0.049251713,neutral,0.083692074,0.03444036,2024-10-28
2024-10-28 15:15:04,AMZN,Amazon com : When is Amazon's Black Friday sale? Here’s everything you need to know,0.051532984,neutral,0.07748173,0.02594875,2024-10-28
2024-10-28 12:05:07,AMZN,"Amazon com : 10 free AI resources from Amazon to help you watch, shop, and learn",0.1432697,neutral,0.15371895,0.0104492465,2024-10-28
2024-10-28 10:49:05,AMZN,Amazon’s latest actions against fake review brokers: Amazon and Google file parallel lawsuits against a fake review website,-0.12837684,neutral,0.034573905,0.16295074,2024-10-28
2024-10-28 09:01:32,AMZN,Guardian’s New Smart AC GDO’s and Beam Smart Controller Now Available to Order,0.35916194,neutral,0.37026718,0.011105246,2024-10-28
2024-10-26 00:14:04,AMZN,"Amazon com : Watch the trailer for ‘Cruel Intentions,’ Prime Video’s intriguing new series premiering November 21",0.024254367,neutral,0.044739306,0.02048494,2024-10-28
2024-10-25 15:13:05,AMZN,"Amazon com : Everything to know about ‘Red One,’ starring Dwayne ‘The Rock’ Johnson and Chris Evans",0.09815636,neutral,0.115263194,0.017106833,2024-10-25
2024-10-25 12:02:08,AMZN,Amazon com : 12 ways you can save time and money shopping on Amazon,0.047580533,neutral,0.06254559,0.0149650555,2024-10-25
2024-10-24 14:23:05,AMZN,Amazon com : Kindle Scribe’s new Gen AI features make organizing and sharing your notes a snap,0.32079914,neutral,0.33042452,0.009625366,2024-10-24
2024-10-24 09:14:05,AMZN,Amazon com : New study confirms large employers like Amazon create positive socioeconomic change across the US,0.705263,positive,0.7412457,0.035982646,2024-10-24
2024-10-24 08:25:15,AMZN,Amazon com : Inside the lab where Amazon is re-imagining retail,0.025048671,neutral,0.046933986,0.021885315,2024-10-24
2024-10-24 04:11:17,AMZN,Unpacking The Implications Of The FTC's Antitrust Case Against Amazon For Online Marketplace Competition,-0.11589682,negative,0.34110627,0.4570031,2024-10-24
2024-10-23 12:21:13,AMZN,Amazon com : 9 Prime membership benefits you might not be using (but should be),0.09995032,neutral,0.11262692,0.012676596,2024-10-23
2024-10-23 12:21:12,AMZN,Amazon com : 5 things you might not know about your Prime membership,0.12344299,neutral,0.13449578,0.011052788,2024-10-23
2024-10-23 10:20:06,AMZN,Meet our toughest eero yet: the Outdoor 7 takes your wifi outside,0.31996,neutral,0.3295,0.009539992,2024-10-23
2024-10-23 06:19:13,AMZN,"Amazon com : Prime membership now includes fuel savings, enabling savings of nearly $70 per year on average",0.20779023,neutral,0.21657686,0.008786641,2024-10-23
2024-10-23 01:31:16,AMZN,WHAT THE OTHER PAPERS SAY THIS MORNING,0.090970166,neutral,0.11511782,0.024147652,2024-10-23
2024-10-22 15:14:05,AMZN,"Amazon com : Bedrock introduces an upgraded Claude 3.5 Sonnet, Anthropic’s most intelligent AI model to date",0.8937772,positive,0.9020674,0.008290257,2024-10-22
2024-10-22 13:14:05,AMZN,Amazon com : enhanced homepage features make shopping easier and more personalized,0.5506032,positive,0.5616376,0.011034388,2024-10-22
2024-10-22 10:17:14,AMZN,"Amazon sets ultra-low pricing plans for Temu rival store, The Information reports",-0.77257353,negative,0.022451838,0.79502535,2024-10-22
2024-10-22 09:14:11,AMZN,Amazon com : One Medical launches AI tools to help doctors get back to focusing on patient care,0.040622573,neutral,0.057002176,0.016379602,2024-10-22
2024-10-22 02:16:10,AMZN,"China And Walmart, Please, For The Love Of ____, Let's Observe A Silver Lining Partnership In An Otherwise Dismal Global Landscape",0.08053058,neutral,0.13372122,0.05319064,2024-10-22
2024-10-18 15:08:04,AMZN,Amazon com : 8 cool features to try in the Amazon Shopping app,0.12915139,neutral,0.14050862,0.011357229,2024-10-18
2024-10-18 13:34:05,AMZN,Amazon com : How to watch Kacey Musgraves’s ‘Deeper Well World Tour’ concert on Prime Video,0.13476785,neutral,0.15066653,0.015898691,2024-10-18
2024-10-18 09:35:10,AMZN,Amazon com : I’ve been delivering with Amazon Flex for 6 years. Here’s what it’s like.,0.056063224,neutral,0.081669405,0.025606181,2024-10-18
2024-10-18 04:16:20,AMZN,Amazon's Nuclear Ambitions,0.27686024,neutral,0.28807068,0.011210442,2024-10-18
2024-10-17 16:33:14,AMZN,Amazon com : will share its Q3 2024 earnings on October 31,0.0034051538,neutral,0.024783736,0.021378582,2024-10-18
2024-10-17 16:04:03,AMZN,Amazon.com to Webcast Third Quarter 2024 Financial Results Conference Call,0.0031550564,neutral,0.02389807,0.020743014,2024-10-18
2024-10-17 12:11:08,AMZN,Amazon com : ‘Election Night Live with Brian Williams’ to stream on Prime Video,0.026441656,neutral,0.041428056,0.0149864005,2024-10-17
2024-10-17 10:47:05,AMZN,Amazon com : AWS and e& Enter Into $1 Billion-Plus Agreement As Part of New Strategic Alliance,0.8845517,positive,0.8941842,0.009632496,2024-10-17
2024-10-17 07:59:07,AMZN,Amazon com : What Amazon is doing to help communities impacted by Hurricanes Helene and Milton,0.04489654,neutral,0.05966703,0.01477049,2024-10-17
2024-10-16 16:46:06,AMZN,"Amazon com : Prime Video’s new competition show ‘Buy It Now’ gives entrepreneurs the chance to pitch to Amazon execs, celebrity judges",0.036453024,neutral,0.0501507,0.013697676,2024-10-17
2024-10-16 13:36:04,AMZN,Amazon com : helps the US Department of Justice thwart international cybercriminal group Anonymous Sudan,0.008960791,neutral,0.08526215,0.07630136,2024-10-16
2024-10-16 11:24:21,AMZN,"Amazon DSP Announces Next-Generation Ad Tech for Precise Full-funnel Reach and Performance; Amazon unveils an all-new Amazon DSP experience, enhanced interoperability, and simplified full-funnel optimization",0.7349817,positive,0.74517083,0.010189123,2024-10-16
2024-10-16 11:11:17,AMZN,Amazon: several nuclear power supply agreements,0.5707998,positive,0.5821678,0.011367954,2024-10-16
2024-10-16 10:32:14,AMZN,Amazon launches new Kindle in color,0.20675567,neutral,0.21574336,0.008987694,2024-10-16
2024-10-16 10:03:03,AMZN,Kindle buying guide: Find out which device is right for you,0.09852679,neutral,0.110834286,0.012307491,2024-10-16
2024-10-16 09:54:11,AMZN,"Amazon Enters the World of Power Generation With Dominion, X-Energt Pacts",0.8395298,positive,0.8472798,0.0077499533,2024-10-16
2024-10-16 09:24:03,AMZN,"Amazon Launches Entirely New Kindle Lineup, Including Reimagined Kindle Scribe and First-Ever Color Kindle",0.22966498,neutral,0.24055082,0.010885835,2024-10-16
2024-10-16 09:12:14,AMZN,Amazon com : first color Kindle has arrived,0.33778483,neutral,0.3531848,0.015399972,2024-10-16
2024-10-14 19:40:05,AMZN,Amazon com : What Amazon is doing to help communities impacted by Hurricanes Helene and Milton,0.04489654,neutral,0.05966703,0.01477049,2024-10-15
2024-10-14 12:10:17,AMZN,Amazon’s latest actions against fake review brokers: New lawsuits target bad actors attempting to deceive customers,-0.036929987,neutral,0.031579085,0.06850907,2024-10-14
2024-10-14 10:24:04,AMZN,Jeff Bezos: Lessons from an entrepreneurial life from A to Z,0.3193084,neutral,0.33067527,0.011366885,2024-10-14
2024-10-14 08:10:05,AMZN,Amazon com : Holiday Beauty Haul is returning October 21 to November 3. Here are 11 of the hottest deals you can shop now.,0.068632916,neutral,0.08208537,0.013452454,2024-10-14
