datetime,ticker,headline,sent_compound,sent_label,sent_positive,sent_negative,trading_day
2024-02-02 11:22:16,META,"Meta: share price soars, broker in support",0.93391126,positive,0.9500672,0.016155977,2024-02-02
2024-02-02 10:08:05,META,Meta: price target raised by Jefferies,0.9351864,positive,0.949921,0.014734609,2024-02-02
2024-02-02 09:10:15,META,Meta: Wedbush raises price target,0.93774146,positive,0.9556262,0.017884733,2024-02-02
2024-02-02 06:17:16,META,"Meta shares jump after first-ever dividend plan, 'Year of Efficiency' pays off",0.92745405,positive,0.9516682,0.024214167,2024-02-02
2024-02-02 02:21:05,META,Meta: initiation of quarterly dividend,0.03970294,neutral,0.05515183,0.015448891,2024-02-02
2024-02-02 01:50:05,META,Meta: EPS triples in Q4,0.91561097,positive,0.92642826,0.010817272,2024-02-02
2024-02-01 16:29:05,META,Meta Platforms Declares First Cash Dividend,0.081258245,neutral,0.096462116,0.015203874,2024-02-02
2024-02-01 16:06:07,META,Meta Reports Fourth Quarter and Full Year 2023 Results; Initiates Quarterly Dividend,-0.010910742,neutral,0.027452469,0.03836321,2024-02-02
2024-02-01 16:06:05,META,Facebook-parent Meta declares first-ever dividend,0.8846268,positive,0.90606374,0.021436956,2024-02-02
2024-02-01 15:59:36,META,Genesis reaches $21 mln SEC settlement in bankruptcy wind-down,0.040162414,positive,0.48463073,0.44446832,2024-02-01
2024-02-01 11:16:35,META,Meta to deploy in-house custom chips this year to power AI drive - memo,0.38540253,neutral,0.39409938,0.008696865,2024-02-01
2024-01-31 13:05:45,META,Meta CEO Zuckerberg apologizes to parents at US Senate social media hearing,-0.20865482,neutral,0.1562742,0.36492902,2024-01-31
2024-01-31 10:51:27,META,US receives thousands of reports of AI-generated child abuse content in growing risk,-0.7619666,negative,0.023128094,0.7850947,2024-01-31
2024-01-31 05:42:23,META,"Meta rents Spanish real estate company Merlin's data centres, Cinco Dias says",-0.6150702,negative,0.029811967,0.6448822,2024-01-31
2024-01-27 13:34:35,META,Musk's X aims to hire 100 content moderators in Austin by end of year,0.34115788,neutral,0.35184795,0.01069007,2024-01-29
2024-01-22 06:32:26,META,"Instagram, Facebook users to get more choices to comply with DMA, Meta says",0.19904988,neutral,0.20785601,0.008806139,2024-01-22
2024-01-18 13:24:41,META,Meta bringing together AI research and product teams,0.7475979,positive,0.75897354,0.011375681,2024-01-18
2024-01-18 07:16:23,META,News Highlights : Top Company News of the Day - Thursday at 7 AM ET,0.8828156,positive,0.8949878,0.012172226,2024-01-18
2024-01-18 07:07:38,META,Reddit seeks to launch IPO in March - sources,0.33329737,neutral,0.34365347,0.010356111,2024-01-18
2024-01-18 05:16:27,META,News Highlights : Top Company News of the Day - Thursday at 5 AM ET,0.090651006,neutral,0.21705589,0.12640488,2024-01-18
2024-01-18 03:16:08,META,News Highlights : Top Company News of the Day - Thursday at 3 AM ET,0.38569912,neutral,0.3977379,0.012038768,2024-01-18
2024-01-18 01:16:08,META,News Highlights : Top Company News of the Day - Thursday at 1 AM ET,0.39138168,neutral,0.403227,0.0118453195,2024-01-18
2024-01-17 23:16:15,META,News Highlights : Top Company News of the Day - Wednesday at 11 PM ET,-0.5605538,negative,0.022116348,0.58267015,2024-01-18
2024-01-09 10:53:39,META,"Meta to restrict more content for teens on Instagram, Facebook",-0.008090891,neutral,0.12107321,0.1291641,2024-01-09
2024-01-09 09:17:22,META,"Meta adds measures to protect teens from harmful content on Facebook, Instagram",0.37823728,neutral,0.4286698,0.050432533,2024-01-09
2024-01-02 05:44:37,META,Mega-cap companies saw strong gains in 2023 amid tech optimism,0.9281222,positive,0.9518729,0.023750657,2024-01-02
2023-12-29 10:40:08,META,Meta Platforms : almost 200% increase this year,0.9212929,positive,0.9322912,0.010998297,2023-12-29
2023-12-27 10:08:12,META,Meta : share price rises as Wedbush raises target,0.9022276,positive,0.91955256,0.017324993,2023-12-27
2023-12-20 05:08:12,META,"EU targets Pornhub, XVideos under new content rules",0.17284337,neutral,0.19304025,0.020196887,2023-12-20
2023-12-20 02:32:55,META,Ukraine's Kyivstar reports difficulties with voice communications,-0.952867,negative,0.011374517,0.9642415,2023-12-20
2023-12-15 22:48:29,META,"Meta, TikTok report jump in Malaysia govt requests to remove content in 2023",-0.94035494,negative,0.0150685,0.9554234,2023-12-18
2023-12-15 17:58:56,META,Judge says TikTok must turn meeting records over in US states probe,-0.7322148,negative,0.060260545,0.79247534,2023-12-18
2023-12-14 22:53:25,META,"Meta, TikTok report jump in Malaysia govt requests to remove content in 2023",-0.94035494,negative,0.0150685,0.9554234,2023-12-15
2023-12-14 07:27:02,META,Meta's Threads Launches in Europe -- Update,0.24697712,neutral,0.25656632,0.009589194,2023-12-14
2023-12-14 07:04:05,META,Meta's Threads Launches in Europe,0.3267908,neutral,0.33686665,0.010075842,2023-12-14
2023-12-13 15:21:33,META,Threads to run tests to make posts available on other social media platforms,0.103375405,neutral,0.113163084,0.009787681,2023-12-13
2023-12-10 14:00:38,META,Slovak FinMin on rating cut : we are on Greek path due to previous government,0.3283035,positive,0.5242009,0.19589743,2023-12-11
2023-12-08 10:41:02,META,"Meta Platforms : BofA reiterates buy, deems AI undervalued",-0.061212152,negative,0.3488786,0.41009074,2023-12-08
2023-12-07 12:29:11,META,Kenya judge finds Meta is not in contempt of court,-0.9459938,negative,0.013019613,0.9590134,2023-12-07
2023-12-06 21:07:01,META,Meta Platforms : Launching Default End-to-End Encryption on Messenger,0.66986924,positive,0.67946625,0.009597011,2023-12-07
2023-12-06 19:58:00,META,Meta to start fully encrypting messages on Facebook and Instagram- WSJ,0.015441975,neutral,0.037352446,0.021910472,2023-12-07
2023-12-04 18:28:03,META,Communications Services Down on Rotation Out of Sector -- Communications Services Roundup,-0.9422096,negative,0.023161422,0.965371,2023-12-05
2023-12-04 10:18:03,META,Meta Faces Lawsuit From Spanish Media Over Advertising Practices -- 2nd Update,-0.93409574,negative,0.0126614235,0.94675714,2023-12-04
2023-12-04 10:15:32,META,"Tech firms, Wall Street lead job cuts in Corporate America",-0.957818,negative,0.010075125,0.9678931,2023-12-04
2023-12-04 08:53:04,META,Meta Faces Lawsuit From Spanish Media Over Advertising Practices -- Update,-0.9322603,negative,0.012460487,0.94472075,2023-12-04
2023-12-04 07:22:02,META,Spanish Media Group Sues Meta Over Advertising Practices,-0.9331137,negative,0.012433894,0.9455476,2023-12-04
2023-12-01 06:57:03,META,Meta : EU questions protection of minors,0.08961187,neutral,0.101338714,0.011726841,2023-12-01
2023-12-01 06:13:10,META,Meta Platforms : Our Work To Fight Online Predators,0.0117910355,neutral,0.060377628,0.048586592,2023-12-01
2023-11-29 14:26:08,META,Social media CEOs to testify at US Senate hearing in January,-0.05024299,neutral,0.030058792,0.080301784,2023-11-29
2023-11-29 09:06:32,META,"Most online hate targets women, says EU report",-0.71930224,negative,0.026481835,0.74578404,2023-11-29
2023-11-27 14:40:36,META,U.S. federal judge rules against Meta in privacy fight with FTC,-0.8561491,negative,0.03516755,0.89131665,2023-11-27
2023-11-24 07:02:54,META,"India warns Facebook, YouTube to enforce rules to deter deepfakes - sources",-0.8083071,negative,0.016522994,0.8248301,2023-11-24
2023-11-23 02:01:21,META,"CSX train derails in Kentucky, spilling molten sulfur",-0.88384223,negative,0.02055259,0.9043948,2023-11-24
2023-11-22 11:35:49,META,Genesis sues Gemini over $689 million in customer withdrawals,-0.94403315,negative,0.013352903,0.9573861,2023-11-22
2023-11-20 17:58:44,META,"White House launches Threads account for Biden, Harris",0.21221404,neutral,0.22328627,0.011072235,2023-11-21
2023-11-18 13:39:46,META,Meta breaks up its Responsible AI team - The Information,-0.9442754,negative,0.009660302,0.9539357,2023-11-20
2023-11-17 03:02:03,META,Meta Faces Probe by Italian Watchdog Over Instagram's Branded Content,-0.93478143,negative,0.013254961,0.9480364,2023-11-17
2023-11-16 15:34:02,META,Meta Platforms : and Christian Louboutin File Joint Lawsuit Against Counterfeiter,-0.7338096,negative,0.0409365,0.77474606,2023-11-16
2024-10-28 17:53:12,NVDA,Tech Up Ahead of Magnificent Seven Earnings -- Tech Roundup,0.77339363,positive,0.80233943,0.028945826,2024-10-28
2024-10-28 01:09:46,NVDA,Asset managers roll out new ETFs to tap in to AI buzz,0.5348763,positive,0.5472612,0.012384867,2024-10-28
2024-10-24 15:01:06,NVDA,"NVIDIA : “India Should Manufacture Its Own AI,” Declares NVIDIA CEO",0.6605132,positive,0.6694416,0.00892833,2024-10-24
2024-10-24 09:10:09,NVDA,‘Call of Duty: Black Ops 6’ Storms Into the Cloud With GeForce NOW,0.29757667,neutral,0.30719212,0.009615441,2024-10-24
2024-10-24 09:10:07,NVDA,"NVIDIA : Zoom’s AI-First Transformation to Boost Business Productivity, Collaboration",0.614831,positive,0.62438303,0.009552062,2024-10-24
2024-10-24 09:05:10,NVDA,Nvidia CEO Jensen Huang gets rock star treatment from India's tech enthusiasts,0.7720857,positive,0.7919439,0.019858204,2024-10-24
2024-10-24 02:38:08,NVDA,The Three Computer Solution: Powering the Next Wave of AI Robotics,0.09030508,neutral,0.10511545,0.014810367,2024-10-24
2024-10-24 02:30:25,NVDA,"NVIDIA : F5 Turbocharge Sovereign AI Cloud Security, Efficiency",0.7853949,positive,0.7920294,0.006634461,2024-10-24
2024-10-24 02:30:23,NVDA,"Start Local, Go Global: India’s Startups Spur Growth and Innovation With NVIDIA Technology",0.76613915,positive,0.77496237,0.00882321,2024-10-24
2024-10-24 02:30:21,NVDA,World’s Greatest Upskill: Consulting Giants Team With NVIDIA to Transform India Into Front Office for AI Era,0.7140604,positive,0.72557145,0.011511002,2024-10-24
2024-10-24 02:30:17,NVDA,Open for AI: India Tech Leaders Build AI Factories for Economic Transformation,0.9213396,positive,0.9330857,0.011746105,2024-10-24
2024-10-24 02:30:16,NVDA,NVIDIA : India’s Robotics Ecosystem Adopts NVIDIA Isaac and Omniverse to Build Next Wave of Physical AI,0.14983894,neutral,0.15957518,0.009736242,2024-10-24
2024-10-24 02:30:14,NVDA,NVIDIA : India Manufacturers Build Factory Digital Twins With NVIDIA AI and Omniverse,0.2438231,neutral,0.25295526,0.009132168,2024-10-24
2024-10-24 02:30:13,NVDA,NVIDIA : Healthcare Leaders Across India Bring NVIDIA NIM for Hindi Language to LLM Applications,0.2084061,neutral,0.21751805,0.009111942,2024-10-24
2024-10-24 02:30:11,NVDA,NVIDIA : India Enterprises Serve Over a Billion Local Language Speakers Using LLMs Built With NVIDIA AI,0.032978483,neutral,0.048968147,0.015989663,2024-10-24
2024-10-24 01:43:14,NVDA,Nvidia rolls out Hindi-language AI model in India as CEO Huang visits,0.7947785,positive,0.8027993,0.008020752,2024-10-24
2024-10-23 14:40:41,NVDA,Reuters Events-US automakers urged to innovate despite tariffs on Chinese rivals,0.0880312,positive,0.39986148,0.31183028,2024-10-23
2024-10-23 09:07:07,NVDA,NVIDIA : How to Accelerate Larger LLMs Locally on RTX With LM Studio,0.2699283,neutral,0.27777627,0.007847962,2024-10-23
2024-10-23 07:16:06,NVDA,NVIDIA : Denmark Launches Leading Sovereign AI Supercomputer to Solve Scientific Challenges With Social Impact,0.7555633,positive,0.76452464,0.008961319,2024-10-23
2024-10-23 05:23:04,NVDA,"EU lags US and China in AI investments, Nvidia CEO says",-0.09702976,neutral,0.0849973,0.18202706,2024-10-23
2024-10-22 09:12:09,NVDA,NVIDIA : What Is Agentic AI,-0.017741013,neutral,0.02961139,0.047352403,2024-10-22
2024-10-22 04:20:29,NVDA,"Nvidia plans to invest in Thailand, Bloomberg News reports",0.16061875,neutral,0.17123777,0.010619016,2024-10-22
2024-10-22 03:14:05,NVDA,"NVIDIA : Brings Generative AI Tools, Simulation and Perception Workflows to ROS Developer Ecosystem",0.35376355,neutral,0.36231598,0.008552443,2024-10-22
2024-10-21 22:35:03,NVDA,NVIDIA : CEO Jensen Huang to Spotlight Innovation at India’s AI Summit,0.4640994,neutral,0.4749193,0.010819894,2024-10-22
2024-10-21 13:17:07,NVDA,NVIDIA : Works With Deloitte to Deploy Digital AI Agents for Healthcare,0.13750523,neutral,0.1493069,0.011801654,2024-10-21
2024-10-21 13:17:06,NVDA,NVIDIA : and Microsoft Give AI Startups a Double Dose of Acceleration,0.84898317,positive,0.8555146,0.0065313918,2024-10-21
2024-10-18 17:28:14,NVDA,Tech Advances as Traders Chase AI Gains - Tech Roundup,0.79938674,positive,0.8825721,0.08318538,2024-10-21
2024-10-18 11:31:11,NVDA,"Nvidia: in the green, BofA raises its target",0.930114,positive,0.9498556,0.019741626,2024-10-18
2024-10-18 10:55:25,NVDA,Nvidia: BofA again raises its price target,0.9282631,positive,0.94262964,0.014366504,2024-10-18
2024-10-17 12:23:04,NVDA,Waterways Wonder: Clearbot Autonomously Cleans Waters With Energy-Efficient AI,0.04222668,neutral,0.06401017,0.021783495,2024-10-17
2024-10-17 12:09:13,NVDA,Sustainable Manufacturing and Design: How Digital Twins Are Driving Efficiency and Cutting Emissions,0.14376685,neutral,0.15374908,0.009982228,2024-10-17
2024-10-17 09:12:07,NVDA,Get Ready to Slay: ‘Dragon Age,0.17093943,neutral,0.18021534,0.009275912,2024-10-17
2024-10-16 19:09:18,NVDA,"Dow notches another record high; banks, small-caps climb",0.89193344,positive,0.9264549,0.034521457,2024-10-17
2024-10-16 13:53:14,NVDA,Druckenmiller Says Selling Nvidia Was a 'Big Mistake',-0.6426919,negative,0.063998364,0.70669025,2024-10-16
2024-10-16 10:04:18,NVDA,Nvidia: towards an open ecosystem for Blackwell,0.6871977,positive,0.69518507,0.007987406,2024-10-16
2024-10-14 21:50:46,NVDA,"US mulls capping Nvidia AI chips exports to some countries, Bloomberg News reports",-0.7830895,negative,0.039108533,0.82219803,2024-10-15
2024-10-14 17:34:53,NVDA,"Nvidia Shares Gain 2.4%, Closing at Highest Level on Record | Closing Bell",0.77813315,positive,0.7930981,0.014964923,2024-10-15
2024-10-14 17:23:13,NVDA,Tech Advances as Nvidia Tests All-Time Highs - Tech Roundup,0.9289247,positive,0.9503053,0.021380583,2024-10-15
2024-10-14 16:48:02,NVDA,Starting to See Efficiency Gains From AI: Simplify's Green,0.84270346,positive,0.8530941,0.010390637,2024-10-15
2024-10-14 13:10:33,NVDA,"Nvidia rallies, poised to dethrone Apple as most valuable company",0.79144377,positive,0.8448858,0.053442053,2024-10-14
2024-10-14 10:24:05,NVDA,MAXimum AI: RTX Accelerated Adobe AI Powered Features Speed Up Content Creation,0.8003198,positive,0.8085219,0.008202151,2024-10-14
2024-10-11 13:15:04,NVDA,NVIDIA : AI Summit Panel Outlines Autonomous Driving Safety,0.1294619,neutral,0.1411847,0.0117227975,2024-10-11
2024-10-11 09:16:05,NVDA,Game-Changer: How the World’s First GPU Leveled Up Gaming and Ignited the AI Era,-0.30449134,neutral,0.037466303,0.34195763,2024-10-11
2024-10-10 10:23:04,NVDA,AI’ll Be by Your Side: Mental Health Startup Enhances Therapist-Client Connections,0.08269275,neutral,0.1076562,0.024963453,2024-10-10
2024-10-10 09:17:58,NVDA,The Next Chapter Awaits: Dive Into ‘Diablo IV’s’ Latest Adventure ‘Vessel of Hatred’ on GeForce NOW,0.32613042,neutral,0.33789927,0.0117688365,2024-10-10
2024-10-10 06:11:25,NVDA,AMD likely to launch new AI chips at San Francisco data center event,0.6920685,positive,0.7012921,0.009223599,2024-10-10
2024-10-09 17:04:06,NVDA,"AI Summit: US Energy Secretary Highlights AI’s Role in Science, Energy and Security",0.74211985,positive,0.7510843,0.008964474,2024-10-10
2024-10-09 11:28:08,NVDA,NVIDIA : What’s the ROI? Getting the Most Out of LLM Inference,0.5242882,positive,0.53350246,0.0092142895,2024-10-09
2024-10-09 10:04:08,NVDA,Flux and Furious: New Image Generation Model Runs Fastest on RTX AI PCs and Workstations,0.29124144,neutral,0.29891503,0.007673603,2024-10-09
2024-10-08 14:29:05,NVDA,NVIDIA : AI Summit Highlights Game Changing Energy Efficiency and AI Driven Innovation,0.36930805,neutral,0.38109148,0.011783408,2024-10-08
2024-10-08 13:31:11,NVDA,"NVIDIA : US Healthcare System Deploys AI Agents, From Research to Rounds",0.249499,neutral,0.2579836,0.008484605,2024-10-08
2024-10-08 12:31:05,NVDA,NVIDIA : SETI Institute Researchers Engage in World’s First Real-Time AI Search for Fast Radio Bursts,0.13179569,neutral,0.1459929,0.014197215,2024-10-08
2024-10-08 12:25:09,NVDA,"NVIDIA : From Concept to Compliance, MITRE Digital Proving Ground Will Accelerate Validation of Autonomous Vehicles",0.72483116,positive,0.73220956,0.007378389,2024-10-08
2024-10-08 12:13:04,NVDA,NVIDIA : TSMC and NVIDIA Transform Semiconductor Manufacturing With Accelerated Computing,0.58326274,positive,0.5930855,0.009822768,2024-10-08
2024-10-08 12:11:19,NVDA,A Not So Secret Agent: NVIDIA Unveils NIM Blueprint for Cybersecurity,0.18476437,neutral,0.19748567,0.012721297,2024-10-08
2024-10-08 11:39:06,NVDA,NVIDIA : Accelerated Computing Key to Yale’s Quantum Research,0.8130681,positive,0.8217001,0.008632021,2024-10-08
2024-10-04 12:47:16,NVDA,"Guns, transgender rights, porn, regulatory powers cases head to US Supreme Court",-0.22452605,neutral,0.039346427,0.26387247,2024-10-04
2024-10-03 17:56:20,NVDA,Tech Up as Nvidia Touts AI Demand -- Tech Roundup,0.9139319,positive,0.93239564,0.018463738,2024-10-04
2024-10-03 13:31:17,NVDA,Big Tech Ramps Up European VC Funding,0.8189158,positive,0.8272781,0.008362298,2024-10-03
2024-10-03 09:20:15,NVDA,NVIDIA : How AI and Accelerated Computing Drive Energy Efficiency,0.100328386,neutral,0.11472525,0.014396861,2024-10-03
2024-10-03 09:19:39,NVDA,"No Tricks, Just Games: GeForce NOW Thrills With 22 Games in October",0.06971073,neutral,0.09297968,0.023268944,2024-10-03
2024-10-02 10:28:31,NVDA,Nvidia: expanded partnership with Accenture,0.88862544,positive,0.89625233,0.007626892,2024-10-02
2024-09-27 19:31:05,NVDA,"Bon Voyage: NIO Unveils ONVO L60 Smart Electric SUV, Built on NVIDIA DRIVE Orin",0.3508567,neutral,0.3599062,0.009049511,2024-09-30
2024-09-27 14:00:59,NVDA,Nvidia's Huang Says Nuclear an Option to Power Data Centers,0.59811234,positive,0.6073599,0.009247566,2024-09-27
2024-09-26 17:53:41,NVDA,Tech Up After Micron Earnings -- Tech Roundup,0.925027,positive,0.9500091,0.024982115,2024-09-27
2024-09-26 12:23:05,NVDA,A Whole New World: ‘GreedFall II,0.053279176,neutral,0.06817091,0.014891736,2024-09-26
2024-09-26 00:42:02,NVDA,"Malaysia generating enough energy surplus for big development projects and exports, PM says",0.8665282,positive,0.8776189,0.011090671,2024-09-26
2024-09-25 20:18:17,NVDA,Nvidia supplier SK Hynix says begins mass production of 12-layer HBM3E chips,0.7642841,positive,0.7734516,0.009167575,2024-09-26
2024-09-23 18:16:07,NVDA,High Speed AI: Hitachi Rail Advances Real Time Railway Analysis Using NVIDIA Technology,0.6310236,positive,0.64211047,0.011086867,2024-09-24
2024-09-23 15:17:04,NVDA,NVIDIA : Partners for Globally Inclusive AI in U.S. Government Initiative,0.5762522,positive,0.58415186,0.007899654,2024-09-23
2024-09-23 14:17:04,NVDA,"NVIDIA : To Save Lives, and Energy, Wellcome Sanger Institute Speeds Cancer Research With NVIDIA Accelerated Computing",0.18109794,neutral,0.19038916,0.009291211,2024-09-23
2024-09-20 10:13:06,NVDA,"NVIDIA : Medical Centers Tap AI, Federated Learning for Better Cancer Detection",0.4394105,neutral,0.44886732,0.009456814,2024-09-20
2024-09-19 10:04:08,NVDA,NVIDIA : ‘FINAL FANTASY XVI’ Soars Into the Cloud With GeForce NOW,0.09457634,neutral,0.10554432,0.010967983,2024-09-19
2024-09-19 10:04:05,NVDA,"Climate Week Forecast: Outlook Improving With AI, Accelerated Computing",0.7133516,positive,0.7216977,0.008346077,2024-09-19
2024-09-18 11:51:05,NVDA,"NVIDIA : AI Aerial Launches to Optimize Wireless Networks, Deliver New Generative AI Experiences on One Platform",0.5661515,positive,0.5750927,0.008941175,2024-09-18
2024-09-18 09:17:28,NVDA,"NVIDIA : How SonicJobs Uses AI Agents to Connect the Internet, Starting with Jobs",0.08664697,neutral,0.10088027,0.014233309,2024-09-18
2024-09-17 10:29:04,NVDA,NVIDIA : Upgrade Livestreams With Twitch Enhanced Broadcasting and the NVIDIA Encoder,0.3983458,neutral,0.40732348,0.008977693,2024-09-17
2024-09-13 11:23:14,NVDA,"CoreWeave in talks for share sale at $23 billion valuation, Bloomberg News reports",0.26298672,neutral,0.2755497,0.012562998,2024-09-13
2024-09-12 09:12:53,NVDA,NVIDIA : GeForce NOW to Bring ‘Dead Rising Deluxe Remaster’ to the Cloud at Launch,0.12405897,neutral,0.13541578,0.011356808,2024-09-12
2024-09-11 17:49:12,NVDA,Tech Up on AI Rebound -- Tech Roundup,0.92575,positive,0.95031714,0.024567103,2024-09-12
2024-09-11 14:56:12,NVDA,Nvidia CEO Says Customer Relations Are 'Tense',-0.9150147,negative,0.01191319,0.92692786,2024-09-11
2024-09-09 12:09:06,NVDA,Live Media Reimagined: NVIDIA Holoscan for Media Now Available for Production,0.4299438,neutral,0.4392977,0.00935391,2024-09-09
2024-09-06 15:31:31,NVDA,Economic worries back on Wall Street's radar after jobs data,-0.89315355,negative,0.031073404,0.92422694,2024-09-06
2024-09-06 14:38:23,NVDA,NVIDIA : How AI Is Personalizing Customer Service Experiences Across Industries,-0.83304024,negative,0.029575665,0.8626159,2024-09-06
2024-09-06 10:10:09,NVDA,Nvidia Faces DOJ Antitrust Investigation: A Potential Turning Point In The AI Industry,-0.5032209,negative,0.20969397,0.7129149,2024-09-06
2024-09-05 11:29:41,NVDA,Short seller Andrew Left's fraud trial moved to September 2025,-0.7177717,negative,0.03670658,0.7544783,2024-09-05
2024-09-05 11:15:04,NVDA,NVIDIA : Three Ways to Ride the Flywheel of Cybersecurity AI,0.14979528,neutral,0.16080032,0.011005045,2024-09-05
2024-09-05 09:22:06,NVDA,NVIDIA : 19 New Games to Drop for GeForce NOW in September,-0.06635746,neutral,0.043614544,0.10997201,2024-09-05
2024-09-04 21:28:13,NVDA,Nvidia Invests in Japanese AI Company's $100 Million Funding Round,0.5569476,positive,0.5655147,0.0085671,2024-09-05
2024-09-04 17:36:24,NVDA,Tech Little Changed as Stability Returns to Sector - Tech Roundup,-0.9570181,negative,0.012433131,0.9694512,2024-09-05
2024-09-04 15:59:01,NVDA,"Nvidia did not receive a US Justice Department subpoena, spokesperson says",-0.24290444,neutral,0.056987394,0.29989183,2024-09-04
2024-09-04 11:42:12,NVDA,Nvidia's stock swoon turns attention to Big Tech's sway over markets,-0.8474949,negative,0.058282737,0.90577763,2024-09-04
2024-09-04 11:19:05,NVDA,Manufacturing Intelligence: Deltia AI Delivers Assembly Line Gains With NVIDIA Metropolis and Jetson,0.51009166,positive,0.51959723,0.009505552,2024-09-04
2024-09-04 09:13:16,NVDA,Hammer Time: Machina Labs’ Edward Mehr on Autonomous Blacksmith Bots and More,0.058275405,neutral,0.07277479,0.014499385,2024-09-04
2024-09-04 09:13:15,NVDA,"Do the Math: New RTX AI PC Hardware Delivers More AI, Faster",0.26754814,neutral,0.2763422,0.008794055,2024-09-04
2024-09-04 06:25:25,NVDA,North American Morning Briefing : Stocks Seen Weaker Again as Fears Build Over Economic Downturn,-0.9649999,negative,0.008731433,0.97373134,2024-09-04
2024-09-03 17:17:11,NVDA,Tech Slides on Chip Demand Fears - Tech Roundup,-0.95273024,negative,0.014932033,0.9676623,2024-09-04
2024-09-03 16:51:05,NVDA,NVIDIA : Investor Presentation September 2024,-0.011840694,neutral,0.02181667,0.033657365,2024-09-04
2024-09-03 16:37:29,NVDA,"Nvidia hit with subpoena from US Justice Department, Bloomberg News reports",-0.76450485,negative,0.061358992,0.82586384,2024-09-04
2024-09-03 14:36:04,NVDA,Nvidia and chip index tumble as investors pause AI rally,-0.96221375,negative,0.010413221,0.972627,2024-09-03
2024-09-03 11:12:10,NVDA,Corporate America has a revenue problem: McGeever,-0.92937773,negative,0.017496197,0.9468739,2024-09-03
2024-09-02 10:43:11,NVDA,Nvidia: Jefferiesconfirms its Buy rating on the stock,0.84040296,positive,0.9039172,0.06351422,2024-09-03
2024-08-29 12:18:04,NVDA,From RAG to Richness: Startup Uplevels Retrieval-Augmented Generation for Enterprises,0.12481222,neutral,0.13889499,0.014082764,2024-08-29
2024-08-29 11:23:20,NVDA,Nvidia: UBS recommends taking advantage of the stock's downturn,0.61787915,positive,0.70525044,0.0873713,2024-08-29
2024-08-29 09:55:04,NVDA,NVIDIA : Company Overview,-0.017360039,neutral,0.019685533,0.037045572,2024-08-29
2024-08-29 09:23:05,NVDA,Crystal-Clear Gaming: ‘Visions of Mana’ Sharpens on GeForce NOW,0.29515365,neutral,0.3065153,0.011361656,2024-08-29
2024-08-29 06:10:16,NVDA,"Nvidia 'beats' as expected, but fallout limited",-0.8663584,negative,0.049175,0.9155334,2024-08-29
2024-08-29 06:10:16,NVDA,"Morning Bid: Nvidia 'beats' as expected, but fallout limited",-0.7498043,negative,0.1092798,0.8590841,2024-08-29
2024-08-29 02:58:05,NVDA,"Tokyo stocks end flat on Nvidia earnings, dip-buying",-0.9411644,negative,0.02003919,0.9612036,2024-08-29
2024-08-29 01:27:11,NVDA,Nvidia: EPS multiplied by 2.5 in Q2,0.92803204,positive,0.9498439,0.021811858,2024-08-29
2024-08-29 00:33:14,NVDA,"Morning Bid: Nvidia watch party over, back to inflation vigil",-0.95024806,negative,0.011633226,0.9618813,2024-08-29
2024-08-28 23:28:05,NVDA,Tokyo stocks fall in morning as Nvidia earnings disappoint,-0.96350783,negative,0.009631399,0.9731392,2024-08-29
2024-08-28 22:30:11,NVDA,Asian shares track Wall Street futures lower as Nvidia disappoints,-0.96252537,negative,0.009151047,0.9716764,2024-08-29
2024-08-28 21:35:31,NVDA,Nations building their own AI models add to Nvidia's growing chip demand,0.82849973,positive,0.8400837,0.011583997,2024-08-29
2024-08-28 20:38:04,NVDA,Tokyo stocks open lower on weak tech issues after Nvidia earnings,-0.96090573,negative,0.009748101,0.97065383,2024-08-29
2024-08-28 18:23:28,NVDA,Nvidia's forecast dampens AI enthusiasm in other tech stocks,-0.9567496,negative,0.014259775,0.9710094,2024-08-29
2024-08-28 17:48:27,NVDA,"Morning Bid: Nvidia waiting game over, caution descends",0.15133421,neutral,0.1780777,0.026743492,2024-08-29
2024-08-23 10:59:15,NVDA,"Nvidia: up sharply, broker raises target",0.93470544,positive,0.9545007,0.019795213,2024-08-23
2024-08-23 08:04:16,NVDA,Nvidia: Wedbush raises price target,0.9265227,positive,0.9441795,0.01765682,2024-08-23
