datetime,ticker,headline,sent_compound,sent_label,sent_positive,sent_negative,trading_day
2024-10-29 18:07:48,AAPL,Apple Unveils the Redesigned Mac Mini,0.10691017,neutral,0.33214507,0.2252349,2024-10-28
2024-10-29 02:21:10,AAPL,Apple blocked from selling iPhone 16 in Indonesia due to local parts rules,-0.867988,negative,0.01536513,0.8833531,2024-10-28
2024-10-28 14:05:22,AAPL,"Apple Rises on Apple Intelligence Rollout, New iMac",0.15887137,neutral,0.16894431,0.010072944,2024-10-28
2024-10-28 12:05:04,AAPL,Apple : How Apple developed the world’s first end to end hearing health experience,0.052437816,neutral,0.06679211,0.014354293,2024-10-28
2024-10-28 11:02:06,AAPL,Apple launches the iPhone into the AI era with free software update,0.40903473,neutral,0.41959044,0.010555705,2024-10-28
2024-10-28 11:02:05,AAPL,"Apple Intelligence is available today on iPhone, iPad, and Mac",0.14214551,neutral,0.15458387,0.01243836,2024-10-28
2024-10-28 11:02:03,AAPL,"Apple unveils the new iMac with M4, supercharged by Apple Intelligence and available in fresh colors",0.2996229,neutral,0.31404552,0.01442264,2024-10-28
2024-10-28 11:01:09,AAPL,Apple introduces the first dose of artificial intelligence into its new product lineup with a free software update,0.018154666,neutral,0.037984278,0.019829612,2024-10-28
2024-10-28 10:29:59,AAPL,"Apple's iPhone 17 to Top 16, CFRA's Zino Says",0.90326715,positive,0.91607463,0.012807464,2024-10-28
2024-10-28 07:51:06,AAPL,Indonesia blocks iPhone 16 sale due to Apple's deficit investment,-0.9510432,negative,0.011635398,0.9626786,2024-10-28
2024-10-28 05:45:59,AAPL,Apple iPhone 16 sales blocked in Indonesia due to local parts rule,-0.9293164,negative,0.01064084,0.93995726,2024-10-28
2024-10-28 03:32:30,AAPL,Apple iPhone 16 Sales Banned in Indonesia Over Investment Issue,-0.9363233,negative,0.009740956,0.94606423,2024-10-28
2024-10-26 13:31:07,AAPL,PureShowers.co.uk Enhances Security and Efficiency with Apple Pay Integration,0.9144819,positive,0.92473817,0.010256309,2024-10-28
2024-10-26 12:01:05,AAPL,Apple and Goldman Sachs must pay $89 million fine for deceptive Apple Card practices,-0.8273192,negative,0.019119723,0.84643894,2024-10-28
2024-10-25 18:19:50,AAPL,"Masimo smartwatches infringe Apple patents, US jury says",-0.18638946,neutral,0.17382468,0.36021414,2024-10-28
2024-10-24 21:04:46,AAPL,"Huawei's Q3 China smartphone sales soar, Apple slips",-0.8415933,negative,0.071474314,0.91306764,2024-10-25
2024-10-24 10:51:26,AAPL,One Tech Tip: How to prepare your online accounts for when you die,-0.13620879,neutral,0.021613076,0.15782186,2024-10-24
2024-10-24 03:01:26,AAPL,One Tech Tip: How to prepare your online accounts in case you die,-0.16176161,neutral,0.021429854,0.18319146,2024-10-24
2024-10-23 20:02:29,AAPL,"Apple CEO says company to increase investment in China, reports Xinhua",0.9131721,positive,0.9242752,0.011103122,2024-10-24
2024-10-23 12:36:18,AAPL,"CFPB Fines Goldman Sachs, Apple Over Credit-Card Partnership Failures -- Update",-0.94670576,negative,0.011089054,0.9577948,2024-10-23
2024-10-23 11:06:34,AAPL,"Apple sharply cuts back on Vision Pro production, The Information reports",-0.9480716,negative,0.009372451,0.9574441,2024-10-23
2024-10-23 11:02:06,AAPL,Apple : Messi’s MLS Cup Playoffs debut to stream free on MLS Season Pass on Apple TV,0.06470281,neutral,0.0762259,0.011523092,2024-10-23
2024-10-23 10:50:14,AAPL,"CFPB Fines Goldman Sachs, Apple Over Credit-Card Partnership Failures",-0.9486422,negative,0.011694802,0.960337,2024-10-23
2024-10-23 10:37:13,AAPL,"US watchdog agency orders Goldman Sachs, Apple to pay $89 million over consumer failures",-0.88567615,negative,0.022325357,0.9080015,2024-10-23
2024-10-23 09:18:41,AAPL,Apple : The new iPad mini is available today,0.35052353,neutral,0.36080423,0.010280699,2024-10-23
2024-10-23 05:35:09,AAPL,Tim Cook Says Apple To Continue Growing in China,0.7083065,positive,0.7169956,0.008689122,2024-10-23
2024-10-23 05:27:36,AAPL,EU antitrust chief nominee vows to intensify Big Tech crackdown,0.17001799,neutral,0.35614222,0.18612424,2024-10-23
2024-10-23 01:50:16,AAPL,Apple's Tim Cook Reaffirms Commitment to China in Second Visit This Year,0.894424,positive,0.9043191,0.0098951105,2024-10-23
2024-10-22 22:07:46,AAPL,Apple CEO Tim Cook met China's minister for industry and IT in Beijing,0.09520794,neutral,0.115893506,0.02068557,2024-10-23
2024-10-22 15:01:10,AAPL,Update to iOS 18 causes battery issues for iPhone 16 users,-0.9520882,negative,0.009243889,0.9613321,2024-10-22
2024-10-21 17:58:33,AAPL,Tech Up on AI Euphoria -- Tech Roundup,0.9039838,positive,0.92835426,0.024370512,2024-10-22
2024-10-21 14:54:17,AAPL,The iPad's Secret AI Advantage,0.41771984,neutral,0.42782822,0.010108392,2024-10-21
2024-10-18 16:04:30,AAPL,IPhone Demand Surges in China,0.9199704,positive,0.9382795,0.018309118,2024-10-21
2024-10-18 09:00:54,AAPL,"Apple Growth Renaissance Has Begun, Says Ives",0.9227057,positive,0.9369343,0.014228589,2024-10-18
2024-10-18 07:31:51,AAPL,Apple Growth Renaissance Has Begun With iPhone 16: Dan Ives,0.92720395,positive,0.9475843,0.020380326,2024-10-18
2024-10-18 03:39:15,AAPL,"Apple's new iPhone sales in China jump 20% in first 3 weeks, Counterpoint says",0.9288958,positive,0.95277745,0.023881681,2024-10-18
2024-10-18 02:19:11,AAPL,Apple Under Scrutiny: A Detailed Look Into The CCI Investigation,0.11413215,neutral,0.14078355,0.026651394,2024-10-18
2024-10-17 22:28:07,AAPL,TSMC stock hits new high after posting forecast-beating earnings,0.91925097,positive,0.9467802,0.027529232,2024-10-18
2024-10-16 15:04:04,AAPL,Apple : expands tools to help businesses connect with customers,0.7481605,positive,0.75732535,0.009164873,2024-10-16
2024-10-16 11:03:27,AAPL,"Apple, Tesla Would Pay More in Taxes Under Trump, Lutnick Says",0.5166131,positive,0.53228563,0.015672525,2024-10-16
2024-10-11 13:48:44,AAPL,"Apple accused of restricting workers' Slack, social media use by US labor board",-0.9144269,negative,0.011699848,0.9261268,2024-10-11
2024-10-11 03:31:05,AAPL,One Tech Tip: Here's what you need to do before and after your phone is stolen or lost,-0.3876907,neutral,0.02293374,0.41062444,2024-10-11
2024-10-10 12:11:07,AAPL,Apple : debuts the first scripted film captured in Apple Immersive Video,0.2694305,neutral,0.279713,0.010282522,2024-10-10
2024-10-10 09:25:06,AAPL,Taiwan says four Foxconn employees detained in China,-0.8877391,negative,0.01458329,0.9023224,2024-10-10
2024-10-10 04:49:39,AAPL,Amazon Adds Apple TV + to Its US Channels Store,0.2341029,neutral,0.29685047,0.06274756,2024-10-10
2024-10-09 23:04:59,AAPL,Amazon adds Apple TV+ to its Prime Video streaming service in US,0.5312886,positive,0.54118764,0.009899028,2024-10-10
2024-10-09 05:59:05,AAPL,US considers asking court to break up Google as it weighs remedies in the antitrust case,-0.58581436,negative,0.044100713,0.62991506,2024-10-09
2024-10-08 10:44:29,AAPL,Apple : Swift Student Challenge to open in February 2025,0.32869858,neutral,0.33898842,0.010289861,2024-10-08
2024-10-08 08:01:55,AAPL,Wireless Power Consortium Names Four New Board Members,0.08114529,neutral,0.09576883,0.014623548,2024-10-08
2024-10-07 17:39:49,AAPL,Why Is iPhone 16 Demand so Soft in China?,-0.3985206,neutral,0.05208938,0.45060995,2024-10-08
2024-10-07 17:21:11,AAPL,Tech Declines as Apple Gets Downgrade - Tech Roundup,-0.9522278,negative,0.0131749865,0.9654028,2024-10-08
2024-10-07 11:43:19,AAPL,"Apple: share price downturn, broker's opinion",-0.94770133,negative,0.016318455,0.9640198,2024-10-07
2024-10-07 08:56:09,AAPL,Apple: Jefferies downgrades its recommendation,-0.90533626,negative,0.03202846,0.9373647,2024-10-07
2024-10-07 06:52:05,AAPL,Expert shares top tips for landing a tech job at Apple,0.2054726,neutral,0.21909525,0.0136226425,2024-10-07
2024-10-05 03:40:35,AAPL,Foxconn third-quarter revenue jumps 20% yr/yr,0.9186992,positive,0.9449098,0.026210584,2024-10-07
2024-10-04 11:45:21,AAPL,Apple Is Working on New iPhone SE and iPads,0.31867987,neutral,0.33422187,0.015541993,2024-10-04
2024-10-03 14:20:06,AAPL,2 Chinese men living in U.S. sentenced for defrauding Apple with fake iPhones,-0.6533954,negative,0.040767103,0.6941625,2024-10-03
2024-10-03 11:38:53,AAPL,Irish tax take up 11% in first nine months of the year,0.8661382,positive,0.8865739,0.02043567,2024-10-03
2024-10-03 01:07:31,AAPL,India's Tata Electronics to partially resume work at fire-hit iPhone component plant,-0.23503804,negative,0.3271684,0.56220645,2024-10-03
2024-10-01 18:39:05,AAPL,Apple : Annual Statement of Changes in Beneficial Ownership - Form 5,0.0068733785,neutral,0.025873216,0.018999837,2024-10-02
2024-10-01 16:17:00,AAPL,Apple Falls as Analysts Debate iPhone Demand Trends,-0.96483666,negative,0.008464048,0.9733007,2024-10-02
2024-10-01 15:43:08,AAPL,"Apple readies new iPhone SE, upgraded iPad Air for early next year, Bloomberg News reports",0.5467576,positive,0.557574,0.010816379,2024-10-01
2024-10-01 09:10:35,AAPL,Ireland to Invest Apple Windfall in Infrastructure Upgrade,0.6357605,positive,0.6453899,0.0096294535,2024-10-01
2024-10-01 09:06:04,AAPL,"Ireland to invest Apple tax cash in housing, energy, water and transport",0.29848835,neutral,0.315685,0.017196666,2024-10-01
2024-10-01 07:35:47,AAPL,"Apple may need to turn to China after Indian Tata plant fire, sources say",-0.95352745,negative,0.010747697,0.9642751,2024-10-01
2024-10-01 07:27:31,AAPL,Ireland edges into top 10 global tax haven ranking,0.88106304,positive,0.8955859,0.014522866,2024-10-01
2024-10-01 05:07:06,AAPL,Huawei's Meng Wanzhou takes over as rotating chairperson,0.041103177,neutral,0.06711983,0.02601665,2024-10-01
2024-10-01 03:56:52,AAPL,Tax cuts and child supports to dominate Ireland's pre-election budget,0.07565272,neutral,0.11864216,0.042989437,2024-10-01
2024-10-01 00:54:19,AAPL,Tata iPhone plant halts production indefinitely after fire,-0.914753,negative,0.009468021,0.92422104,2024-10-01
2024-09-30 19:07:09,AAPL,"Ireland to unveil bumper pre-election budget, Apple windfall plans",0.7820967,positive,0.80073196,0.018635292,2024-10-01
2024-09-30 11:55:10,AAPL,"Apple: UBS, concerned about iPhone sales, remains 'neutral",-0.70153177,negative,0.11037367,0.81190544,2024-09-30
2024-09-29 04:40:52,AAPL,India to probe fire at Tata plant making components for Apple iPhones,-0.7261403,negative,0.016811589,0.7429519,2024-09-30
2024-09-28 07:49:09,AAPL,Past disruptions at Apple facilities in India,-0.9590719,negative,0.006851716,0.9659236,2024-09-30
2024-09-27 15:25:24,AAPL,Apple's iPhone 16 Receives a Lackluster Reception,-0.019100249,negative,0.3332555,0.35235575,2024-09-27
2024-09-27 12:26:55,AAPL,Irish budget surplus to surge to 8% of national income after Apple windfall,0.92289,positive,0.9513102,0.028420204,2024-09-27
2024-09-26 17:53:09,AAPL,"Apple Tax Boon to Go Toward Housing, Energy",0.166138,neutral,0.17766687,0.0115288785,2024-09-27
2024-09-25 10:01:09,AAPL,Users report problems with touchscreen iPhone 16 Pro,-0.92515194,negative,0.009513803,0.93466574,2024-09-25
2024-09-25 09:09:01,AAPL,India's manufacturing incentives progress amid efforts to cut China imports,0.9193625,positive,0.93712354,0.01776108,2024-09-25
2024-09-25 06:47:14,AAPL,"Foreign smartphone sales in China drop 12.7% in August, data show",-0.9676554,negative,0.0074075516,0.97506297,2024-09-25
2024-09-24 02:14:11,AAPL,"Precluded, Not Repeated: WARF & Apple Continue To Shape Our Understanding Of Issue Preclusion In Patent Law",0.009064082,neutral,0.048156876,0.039092794,2024-09-24
2024-09-20 17:04:51,AAPL,Apple Threads Needle to Find iPhone 16 Buyers: Power On,0.14680004,neutral,0.16258454,0.015784508,2024-09-23
2024-09-20 15:12:56,AAPL,Apple iPhone Hits Stores Without AI Features,0.15782648,neutral,0.18332614,0.025499657,2024-09-20
2024-09-20 11:30:00,AAPL,New iPhone 16 unveiled in Russia as retailers skirt export ban,0.6907426,positive,0.7176013,0.02685866,2024-09-20
2024-09-20 05:08:58,AAPL,"Climate Asset Management has raised more than $1 billion, CEO says",0.49513167,positive,0.5034346,0.00830292,2024-09-20
2024-09-20 02:55:05,AAPL,"Apple : The iPhone 16 lineup, AirPods 4, Apple Watch Series 10 arrive around the world",0.047925822,neutral,0.05973397,0.011808148,2024-09-20
2024-09-19 20:37:12,AAPL,"Huawei's $2,800 tri-fold phone hits stores amid supply concerns",0.63313204,positive,0.73431003,0.10117797,2024-09-20
2024-09-19 17:07:13,AAPL,Tech Rallies as 'Magnificent Seven' Ride Again - Tech Roundup,0.8520438,positive,0.89249134,0.04044754,2024-09-20
2024-09-19 16:52:42,AAPL,Apple Gets EU Warning on Operating System,-0.9422887,negative,0.013054404,0.9553431,2024-09-20
2024-09-19 13:38:05,AAPL,Apple : brings California driver’s licenses and state IDs to Apple Wallet,0.09531315,neutral,0.10810671,0.012793567,2024-09-19
2024-09-19 09:51:16,AAPL,Apple: two interoperability procedures initiated by the EU,0.70458907,positive,0.7149795,0.010390441,2024-09-19
2024-09-19 09:24:21,AAPL,EU to Offer Apple Guidance on Digital Rules Compliance -- Update,0.19824567,neutral,0.20844436,0.010198689,2024-09-19
2024-09-19 08:09:07,AAPL,Apple Stops Abuse Of Process,-0.7952737,negative,0.03514894,0.83042264,2024-09-19
2024-09-19 06:10:06,AAPL,The Critical Importance Of Substance In Transfer Pricing – The CJEU's Decision In EU Commission Vs Apple & Ireland - C‑465/20,0.704961,positive,0.71688026,0.011919231,2024-09-19
2024-09-19 05:55:56,AAPL,EU antitrust regulators tell Apple how to comply with tech rules,0.099051446,neutral,0.13592774,0.036876295,2024-09-19
2024-09-19 04:50:02,AAPL,New iPhone 16 unveiled in Russia as retailers skirt Apple's export ban,0.8499655,positive,0.872338,0.022372477,2024-09-19
2024-09-19 01:01:07,AAPL,Group claim against Apple for excessive streaming fees,-0.85738164,negative,0.017635958,0.8750176,2024-09-19
2024-09-18 14:01:10,AAPL,Apple launches major update with iOS 18: Here are the main new features,0.07566366,neutral,0.08618981,0.010526143,2024-09-18
2024-09-17 12:31:12,AAPL,"JPMorgan in talks with Apple to take over its credit card program, WSJ reports",0.08228658,neutral,0.10595154,0.023664955,2024-09-17
2024-09-17 12:23:48,AAPL,"JPMorgan in talks with Apple to take over credit card program from Goldman, WSJ reports",0.08136922,neutral,0.10173816,0.020368945,2024-09-17
2024-09-16 16:42:22,AAPL,Apple Hit by iPhone 16 Gloom,-0.9495694,negative,0.014299509,0.9638689,2024-09-17
2024-09-16 13:09:25,AAPL,"Apple : IOS 18 is available today, making iPhone more personal and capable than ever",0.23359057,neutral,0.24335122,0.009760654,2024-09-16
2024-09-16 13:09:23,AAPL,Apple : MacOS Sequoia is available today,0.15363292,neutral,0.16218247,0.008549539,2024-09-16
2024-09-16 13:09:21,AAPL,"Apple : IPadOS 18 is now available, taking iPad to the next level",0.2677677,neutral,0.27772233,0.009954636,2024-09-16
2024-09-16 13:09:20,AAPL,Apple : WatchOS 11 is available today,0.028728012,neutral,0.04243668,0.013708671,2024-09-16
2024-09-16 13:09:18,AAPL,Apple : VisionOS 2 for Apple Vision Pro is available today,0.15647906,neutral,0.16502535,0.00854629,2024-09-16
2024-09-16 13:09:17,AAPL,Apple : TvOS 18 is now available,0.42453772,neutral,0.4339254,0.00938767,2024-09-16
2024-09-16 13:09:15,AAPL,Apple : Maps introduces new ways to explore the world,0.23713672,neutral,0.24820039,0.011063672,2024-09-16
2024-09-16 13:01:06,AAPL,IOS 18 for iPhone now available worldwide: which devices can download it?,0.15904216,neutral,0.16857511,0.00953294,2024-09-16
2024-09-13 14:33:22,AAPL,Apple Inc. : AirPods become hearing aids and revolutionize the industry,0.6618032,positive,0.67189205,0.010088885,2024-09-13
2024-09-13 11:24:05,AAPL,Behind the Scenes at Apple Event 2024: How the iPhone 16 Pro and SmallRig Phone Cage Created Cinematic Magic?,0.14870207,neutral,0.15816651,0.009464448,2024-09-13
2024-09-13 09:23:11,AAPL,FDA Authorizes First Over-the-Counter Hearing Aid Software,0.5060215,positive,0.5152677,0.009246209,2024-09-13
2024-09-13 02:15:07,AAPL,The CJEU Draws A Line Under The Apple State Aid Saga,-0.36993593,negative,0.117632344,0.48756826,2024-09-13
2024-09-12 11:45:48,AAPL,FDA authorizes first OTC hearing aid software to be used in Apple's AirPods Pro,0.40520495,neutral,0.41649562,0.01129067,2024-09-12
2024-09-12 11:11:05,AAPL,"Apple : Get ready to upgrade to the new iPhone 16, Apple Watch, and AirPods lineups",0.2550781,neutral,0.26622933,0.0111512365,2024-09-12
2024-09-12 06:27:41,AAPL,"Apple back taxes hand Ireland infrastructure opportunities, PM Harris says",0.90338403,positive,0.9162526,0.012868605,2024-09-12
2024-09-11 04:27:05,AAPL,UScellular to Offer All-New iPhone 16 Lineup,0.09515771,neutral,0.10388616,0.008728447,2024-09-11
2024-09-11 04:01:09,AAPL,Huawei beats Apple: 3 million pre-orders for triple foldable phone,0.8754624,positive,0.8832154,0.007753014,2024-09-11
2024-09-11 01:30:27,AAPL,India's bid to match China's factory heft gets a reality check,0.88220227,positive,0.90128905,0.019086776,2024-09-11
2024-09-10 15:46:59,AAPL,Apple's Big Bet on AI,0.076646246,neutral,0.09003029,0.013384042,2024-09-10
2024-09-10 15:28:34,AAPL,"Apple Unveils iPhone 16, New Watches, Touts AI Features",0.6772614,positive,0.68694323,0.009681803,2024-09-10
2024-09-10 15:21:38,AAPL,"Apple, Google Lose Multibillion Dollar EU Court Fights",0.37860027,positive,0.67030114,0.29170087,2024-09-10
2024-09-10 13:40:01,AAPL,How AI features of iPhone and rival smartphones stack up,0.5995007,positive,0.61363816,0.014137433,2024-09-10
2024-09-10 12:59:53,AAPL,"EU triumphs in court fight with Google and Apple, which now owe billions in fines and back taxes",-0.8674654,negative,0.051960558,0.91942596,2024-09-10
2024-09-10 12:26:44,AAPL,"EU flexes regulatory muscle, forcing Google and Apple to pay billions in fines and back taxes",-0.88956577,negative,0.044456694,0.9340225,2024-09-10
2024-09-10 11:24:31,AAPL,Apple: Wedbush Securities raises its price target,0.9217183,positive,0.9411054,0.019387135,2024-09-10
2024-09-10 11:19:05,AAPL,Google and Apple have to pay billions in fines and back taxes after EU rejects their final appeals,-0.8604898,negative,0.060419317,0.9209091,2024-09-10
2024-09-10 11:01:14,AAPL,Apple introduces new iPhone 16 series: faster processor and new camera button,0.2537205,neutral,0.26360828,0.009887785,2024-09-10
2024-09-10 10:51:38,AAPL,Huawei debuts tri-fold smartphone hours after Apple's new iPhone,0.6179234,positive,0.6367237,0.018800337,2024-09-10
2024-09-10 09:08:33,AAPL,"EU's Vestager: Need to Own Wins, Losses on Big Tech Cases",0.87665063,positive,0.8940958,0.017445134,2024-09-10
2024-09-09 22:02:53,AAPL,"Huawei teases tri-fold smartphone, raising competition with Apple in China",0.900226,positive,0.90998554,0.009759521,2024-09-10
2024-09-09 18:57:04,AAPL,"Apple announces iPhone 16, the first phone 'from the ground up' built for AI",0.177802,neutral,0.18846962,0.010667624,2024-09-10
2024-09-09 18:54:14,AAPL,Apple debuts iPhone 16 with AI software,0.24041492,neutral,0.25084832,0.010433413,2024-09-10
2024-09-09 16:02:26,AAPL,"Apple Unveils iPhone 16, Touts AI Features",0.18621828,neutral,0.19792034,0.011702062,2024-09-10
2024-09-09 15:54:57,AAPL,"A Look at Apple's iPhone 16, New Devices",0.25723782,neutral,0.26580516,0.008567332,2024-09-09
2024-09-09 15:46:23,AAPL,How Apple Sets the Rules,0.24038596,neutral,0.25128096,0.010895002,2024-09-09
2024-09-09 15:01:08,AAPL,"Apple launches new iPhones, Apple Watches and AirPods",0.029189803,neutral,0.044011857,0.014822055,2024-09-09
2024-09-09 14:53:25,AAPL,Apple iPhone 16 event: Key announcements so far,0.1078781,neutral,0.11833714,0.010459041,2024-09-09
2024-09-09 14:45:04,AAPL,"Apple : Intelligence comes to iPhone, iPad, and Mac starting next month",0.042285208,neutral,0.05804992,0.015764713,2024-09-09
2024-09-09 14:42:03,AAPL,Apple introduces groundbreaking health features to support conditions impacting billions of people,0.72696215,positive,0.7368093,0.009847136,2024-09-09
2024-09-09 14:38:03,AAPL,Apple introduces AirPods 4 and the world’s first all-in-one hearing health experience with AirPods Pro 2,0.3339355,neutral,0.3431612,0.009225683,2024-09-09
2024-09-09 14:37:08,AAPL,Apple Watch Ultra 2 now available in black titanium,0.4765847,neutral,0.48678094,0.010196249,2024-09-09
2024-09-09 14:37:06,AAPL,Apple debuts iPhone 16 Pro and iPhone 16 Pro Max,0.77660054,positive,0.78651166,0.0099111395,2024-09-09
2024-09-09 14:37:05,AAPL,Apple introduces iPhone 16 and iPhone 16 Plus,0.45129257,neutral,0.46065378,0.009361194,2024-09-09
2024-09-09 14:37:03,AAPL,Introducing Apple Watch Series 10,0.16248962,neutral,0.1794674,0.016977776,2024-09-09
2024-09-07 04:28:40,AAPL,"New iPhone will use Arm's chip technology for AI, FT reports",0.14355314,neutral,0.15300736,0.009454222,2024-09-09
2024-09-06 10:10:10,AAPL,Comparative Analysis Of Apple's Legal Challenges Across Jurisdictions,-0.8764102,negative,0.023608869,0.90001905,2024-09-06
2024-09-05 10:09:04,AAPL,"Apple : Eight games join Apple Arcade, including Balatro+ and NBA 2K25 Arcade Edition",0.13804092,neutral,0.15363415,0.015593234,2024-09-05
2024-09-04 10:24:16,AAPL,"Apple: UBS raises price target, remains 'neutral",0.9203749,positive,0.9450249,0.024650011,2024-09-04
2024-09-03 05:56:10,AAPL,"Apple to completely switch to OLED for iPhone display from 2025, Nikkei says",0.14834583,neutral,0.16416529,0.015819466,2024-09-03
2024-09-03 02:16:09,AAPL,Federal Circuit Clarifies Scope Of Patent Owner Estoppel,-0.009642448,neutral,0.03078758,0.040430028,2024-09-03
2024-09-02 14:01:05,AAPL,First iPhone 17 rumors: More RAM for optimal use Apple Intelligence,0.06780725,neutral,0.08074879,0.01294154,2024-09-03
2024-09-02 04:10:05,AAPL,Why Is Apple Inc. Being Sued For Alleged Copyright Infringement?,-0.8918401,negative,0.014715208,0.9065553,2024-09-03
2024-09-01 23:07:23,AAPL,"Apple set for music, TV streaming fight in India after Airtel deal",0.9261756,positive,0.9404927,0.014317068,2024-09-03
2024-08-29 11:04:11,AAPL,Apple : Sports is ready for football season,0.047276605,neutral,0.06114095,0.013864345,2024-08-29
2024-08-29 04:01:08,AAPL,One Tech Tip: How to get the most life out of your device,0.064942695,neutral,0.08899233,0.024049632,2024-08-29
2024-08-27 23:15:06,AAPL,"Apple cuts about 100 jobs in its services division, Bloomberg News reports",-0.9611696,negative,0.009342427,0.97051203,2024-08-28
2024-08-27 14:43:11,AAPL,India's Bharti Airtel announces content partnership with Apple,0.88148314,positive,0.8900848,0.008601668,2024-08-27
2024-08-24 02:01:05,AAPL,'Apple presents new iPhones on Sept. 10',0.06497144,neutral,0.07510371,0.010132271,2024-08-26
2024-08-23 07:00:08,AAPL,Tech Veteran Curtis Jones Acquires Leading USVI Digital Innovation Firm MEPSVI,0.7823128,positive,0.7900231,0.00771028,2024-08-23
2024-08-23 06:01:10,AAPL,Apple revamps EU browser options and default apps,0.0708665,neutral,0.08971032,0.018843817,2024-08-23
2024-08-23 05:01:09,AAPL,Apple gives European users even more choice,0.37244964,neutral,0.38146055,0.009010897,2024-08-23
2024-08-21 11:01:05,AAPL,New iPhone SE gets AI features from Apple Intelligence,0.16956237,neutral,0.1783916,0.00882924,2024-08-21
2024-08-21 09:05:06,AAPL,Apple : and 4-H are bringing technology to a new generation of learners,0.15781823,neutral,0.16752775,0.009709516,2024-08-21
2024-08-20 14:01:12,AAPL,The iPhone 16-series will be available in these colors,0.23238152,neutral,0.24527067,0.012889153,2024-08-20
2024-08-20 06:11:09,AAPL,AWS CodeBuild now supports Mac builds,0.051919274,neutral,0.063912034,0.011992758,2024-08-20
2024-08-19 11:06:03,AAPL,Apple : celebrates America’s national parks,0.28700733,neutral,0.29694355,0.0099362265,2024-08-19
2024-08-17 11:11:06,AAPL,Foxconn chief defends hiring practices after report married women rejected in India,-0.9352207,negative,0.014375656,0.94959635,2024-08-19
2024-08-17 01:02:05,AAPL,Fortnite returns on iPhones and iPads,0.019904682,neutral,0.048551504,0.028646821,2024-08-19
2024-08-16 13:01:06,AAPL,Fortnite returns to Apple and Google's app stores,0.15455085,neutral,0.16478693,0.010236089,2024-08-16
2024-08-16 05:46:24,AAPL,Apple-Developers can soon offer in-app NFC transactions using the Secure Element,0.17526968,neutral,0.18499255,0.009722872,2024-08-16
2024-08-15 13:21:04,AAPL,Apple : Driver’s licenses and state IDs in Apple Wallet are coming soon to California,0.09605196,neutral,0.10969947,0.013647513,2024-08-15
2024-08-15 03:01:11,AAPL,Apple also opens NFC chip iPhone to countries outside EU,0.1408541,neutral,0.14907353,0.008219415,2024-08-15
2024-08-14 19:30:00,AAPL,India's Modi meets Foxconn chief amid govt probe into hiring practices,-0.57198536,negative,0.15462814,0.7266135,2024-08-15
2024-08-14 12:10:09,AAPL,Federal Circuit Clarifies Scope Of § 42.73(d)(3)(i) Estoppel In Interrelated USPTO Proceedings,0.005469721,neutral,0.057445336,0.051975615,2024-08-14
2024-08-14 11:35:11,AAPL,Apple : Developers can soon offer in‑app NFC transactions using the Secure Element,0.17622681,neutral,0.18511727,0.008890471,2024-08-14
2024-08-14 05:37:09,AAPL,Apple Entrepreneur Camp applications are now open,0.21479495,neutral,0.22414152,0.009346574,2024-08-14
2024-08-14 02:53:28,AAPL,Apple supplier Foxconn's Q2 profit rises 6% thanks to AI boom,0.93142515,positive,0.9543407,0.022915523,2024-08-14
2024-08-14 02:16:17,AAPL,"Apple supplier Foxconn's Q2 profit rises 6% on year, beats forecasts",0.93654174,positive,0.95599353,0.019451797,2024-08-14
2024-08-13 03:19:42,AAPL,India orders unusual recall of reports on Apple antitrust probe,-0.9435245,negative,0.0122060375,0.9557305,2024-08-13
2024-08-12 02:14:13,AAPL,Quarterly Competition Law Bulletin - 2024 Second Quarter,0.05406735,neutral,0.067328766,0.013261417,2024-08-12
2024-08-09 12:11:09,AAPL,Ederal Circuit Clarifies Reach Of Patent Estoppel In SoftView v. Apple,-0.38836882,neutral,0.06668223,0.45505103,2024-08-09
2024-08-07 13:23:08,AAPL,Apple : MLB announce September “Friday Night Baseball” schedule,0.008198632,neutral,0.031612944,0.023414312,2024-08-07
